paperId,venue_id,year,edition,location,pages,new_conference_name,editionId
0110f7c903ea41f5e45c0c526512c043b975325d,4802a885-b293-4af7-b45f-fabb2d74652a,2021.0,4.0,South Brandonburgh,298-303,International Conference on Information Management and Technology,3e46ad33-d3be-4d06-864c-d38e36b6842c
e38cc62f0272a5437e8f05c926fe3e363e559cbc,ba1e9488-a629-4abe-a0c2-ec2c79c91616,2020.0,3.0,Howardfurt,961-968,IEEE International Conference on Tools with Artificial Intelligence,2684c246-227c-4df0-811e-3d50230718dc
53e65a7e95daba84b72ba075a7f03e1b2c512971,b189dec0-41d0-4cea-a906-7c5186895904,2019.0,5.0,Savageburgh,1-6,Global Communications Conference,ed9a3386-4aa3-4aef-bb64-3d03f206ba35
ba4b6a783ba8f649ff74a10928ad9972218eec01,0cb0dcea-43f4-4a34-a1c3-ac211434f660,2021.0,6.0,North Alyssa,291-299,International Conference Computing Methodologies and Communication,57daf6a1-0322-4c66-b8cc-79061c668719
92347a9803add18f9613df01cf0685d8e472e856,0d6f7fba-7092-46b3-8039-93458dba736b,2020.0,7.0,North Debbieshire,8324-8328,"IEEE International Conference on Acoustics, Speech, and Signal Processing",69767b21-db59-4ee4-a9da-d8b590e6825b
14be3e7a76b7b38c7985f3408de28141a6df542b,e4f51561-5050-4b9c-87c2-c49957677fbf,2022.0,6.0,Port Rebeccaberg,,European Conference on Computer Systems,02d8bb23-70f7-4320-9e4c-baf34672b1dd
cd2b197cd8c29f11dc66a104b26cad8d512ef20a,36949878-72e1-4ce8-8c7e-444cf4922345,2019.0,3.0,Port Dean,547-551,Computer Science in Cars Symposium,199ffca4-2d84-41b6-a8e6-aba8377c1e90
af9e942cba8352b7517acef336f12a937237f09b,e07422f9-c065-40c3-a37b-75e98dce79fe,2023.0,7.0,Wuberg,,The Web Conference,a99e0041-7196-446e-b1d0-8aa2cef4423d
8da83f08e29fcbb2a041008aad324665682bb670,e84bb5a1-8f79-42cc-8eb1-3a52f7c73d63,2019.0,4.0,New Lauraborough,2121-2126,"IEEE International Conference on Systems, Man and Cybernetics",f5d2529a-6836-40ac-b52d-7f4a6b6dfa16
6f5ee7dc4d74c5e4ae0ce62e3825f56be1fc7311,ed2ab707-f82e-4684-84d9-3327a4372889,2017.0,3.0,Lauraside,388-397,Conference on Business Informatics,956ecb4b-de59-4094-b58e-b485613dc637
db79b27df4b778dc53ac9268e3aed1d133854fd5,99026156-eedd-4e3c-9797-a7eca6658ad3,2020.0,3.0,South Richardside,000179-000184,IEEE International Conference on Cognitive Infocommunications,54ce5ad7-c774-4866-937a-59eb99a340a9
48ee0ff5de5832fd604edcec7426797eb90d3e1f,74f47cf8-2839-4a56-959a-524dd0ed9e3e,2020.0,4.0,East Alexis,347-358,International Conference on Extending Database Technology,e07c3044-0b7d-4da5-9da6-436c1076e0e7
b941a7b03ca8a1dea327ce5ab9281812064f8eed,3454cd32-76b1-4baa-88f8-7faa8c04abd1,2020.0,4.0,Mendezview,1-6,Advanced Industrial Conference on Telecommunications,97fa03c7-b950-408e-8d39-7250c202b310
96b06de775fbfb947347ce2b82be3010a27266c5,764e3630-ddac-4c21-af4b-9d32ffef082e,2021.0,9.0,Port Davidfurt,1188-1199,IEEE International Conference on Data Engineering,dcbe51f5-79e0-47fb-ae2a-3569d3a9cc1c
fcf7030cd4c51be2bf58187b05b5b4972dc7788d,ac650ef9-6a98-4689-85b7-f9d91dedf5e0,2023.0,3.0,Lake Christinefort,823-829,IEEE International Conference on Industry Applications,c9235991-f2f7-488b-bd07-4e28684116d1
dd2f5609714bf63abd689c955cbc5ae8e35cbe81,1666219b-23e8-4300-acf2-d044d744a3f7,2022.0,3.0,Port David,1-8,International Conference Control and Robots,122aa8fc-9efd-439f-9b20-b518f4cdb717
501ca24271d49a41549a7f56d113b42d4c61ddda,8c36c300-10f5-4008-ae53-6371fcc3030d,2024.0,5.0,West Laurie,1-6,International Conferences on Information Science and System,f14e0a69-696a-40a9-83b1-1446884118f4
48402bec037fc2a5033c4dc7f90733b7e86da446,bdc2e585-4e48-4e36-8af1-6d859763d405,2023.0,7.0,Alexisville,4972-4980,AAAI Conference on Artificial Intelligence,749b0914-f8d0-448b-8b4d-27c5d627efdc
90a87b0018433c85b85f3ba308f3f5a2a8aa4aae,764e3630-ddac-4c21-af4b-9d32ffef082e,2024.0,12.0,Joestad,4951-4964,IEEE International Conference on Data Engineering,e2f793c6-eb39-415a-906d-5c4387aaab8a
96a05940ac401e542847c41a39798e520505ad8b,f2565195-d1b6-4c16-a085-763516ef0872,2017.0,3.0,East Nancyview,1-8,International Conference on Advanced Computer Science and Information System,0ea03f39-70ae-48ea-bd7d-e070baae9026
613dd12b854e70cfc3710c5d041c7e7e308b1257,0c1420a4-aa9b-44f9-b264-ba3ac5c37050,2017.0,3.0,Lake Crystal,1-12,"International Conference for High Performance Computing, Networking, Storage and Analysis",9b725a1d-9b25-4bd5-a0eb-a32e29079684
a22cb621d7ff0315891a0a4d4319b9c189bc9e77,9ec28b59-afd2-4d10-9a97-44d984123c30,2019.0,5.0,Frederickshire,83-88,IEEE International Conference on Information Reuse and Integration,385c9fe6-f132-4539-9af8-4857306835e2
8a47be7c12d214e9afde07ffe6cbaee727aeac47,72b1619c-55d6-4f98-9218-23cd8aa74091,2023.0,3.0,North Grantside,419-425,"IEEE Uttar Pradesh Section International Conference on Electrical, Computer and Electronics Engineering",746a8251-2a9c-4caf-9f5f-d94b2f06575b
ea38182f7626bb75b12a1f35b97664c8a3298209,764e3630-ddac-4c21-af4b-9d32ffef082e,2022.0,10.0,North Jamesview,885-897,IEEE International Conference on Data Engineering,760ed92f-a592-406e-8d91-161eff52032e
9752fcbd064d1dd358ce9f5f1be4c569a035cddd,6064dbc1-afde-4d04-bece-348066a5a0f3,2023.0,3.0,West Michaelland,206-211,International Enformatika Conference,8f8f2713-e229-4e97-bfbf-fabf2b37ff5b
1fdc4208c409f3fc79a682b3ee82917b9870a034,64c0e3be-ec7c-424d-bf61-495e56d9da6d,2023.0,3.0,Lake Anthony,,Proceedings of the International Conference on Industrial Engineering and Operations Management,bff13a2d-1f68-4009-8828-d386e48d0bb5
d49a0853da7c4c12b82208d8fe6cd584f2cede11,0597d0e9-7b01-49cc-817d-8eb0725b464b,2022.0,3.0,New Jamesfurt,1-5,International Conference on Data and Software Engineering,f0035711-9dae-4049-aeed-dc306e5b9767
15c1493b668730bde772d30f6ebac05235c75f5a,b877cd38-7f65-4f61-aa13-3413da5de430,2024.0,3.0,Lake Timothy,,MATEC Web of Conferences,90c7ceeb-17a6-4842-bee3-f69caf40f25e
81ae967371e06827e97094ab0a67f860f5632977,6864fc0f-dd47-4798-a829-ac53dd78862f,2020.0,3.0,Erinhaven,,International ACM SIGACCESS Conference on Computers and Accessibility,216ec456-0bda-4588-a1c1-562f4420aa18
50a371280bd3cfc9b308336a9d598fa6f4709ec5,e1afedcc-2543-4f61-b797-bc52344438e7,2023.0,4.0,Lake Teresa,1-6,"International Conference on Social Networks Analysis, Management and Security",3be8938e-5b04-4bb4-8436-71bf1389d125
1960404445e307b541c3b6ec536dffc3ee082e8a,54c34256-7049-4afc-ad8d-f2b68cca0a45,2023.0,3.0,Donovanport,1-10,"SouthEast European Design Automation, Computer Engineering, Computer Networks and Social Media Conference",1ededa68-153d-44b1-884c-3b044a47a5ba
093d57627eedaa0fec3c893078adf2d6aa7dcf4d,86c43745-31d9-4c1a-b33f-ce3aa0042dbb,2020.0,3.0,Whiteville,315-332,USENIX Symposium on Operating Systems Design and Implementation,e653fb17-c21c-40a6-bd12-78f55a47521f
4c43ed595916beefce10118692a581472cf7a29a,7431ff67-91dc-41fa-b322-1b1ca657025f,2017.0,4.0,Sancheztown,,International Conference on Information and Knowledge Management,3184d49f-ec72-417b-b3b7-d37dad8067f9
134195def540ca50234aae3d978a17a9799d1949,72017ba4-9cc9-45cc-89cb-ced49936b1c0,2017.0,3.0,Jeannemouth,1240-1245,"International Conference on Computing, Communication and Automation",f56b669d-b740-4aa0-919f-e94916a82d0e
aee69cf1e403c2aae27d5dc663ea8165a9b4a6d3,9039088a-b047-49bc-b12a-3334017ad93d,2021.0,3.0,Wrightside,198-204,Asia-Pacific Conference on Communications,a195fd39-116e-4158-9316-2db6a1687aa8
39af150705b288e7bd058947d970dde2d179bec3,b189dec0-41d0-4cea-a906-7c5186895904,2018.0,4.0,East Ericland,1-6,Global Communications Conference,aa3448a0-2595-468e-9d15-abb0b0552ae6
6d462c657b3b9ee6fd5442e05cba357a5d06ac2c,7431ff67-91dc-41fa-b322-1b1ca657025f,2023.0,9.0,East Christopher,,International Conference on Information and Knowledge Management,7e7f585f-2b32-465d-b124-640de6e8ca50
160fec318237da0bc55989df4242f4f103503366,6be078fe-e448-4123-8096-25493e7a2502,2018.0,4.0,Lake Patrickberg,1-5,ARES,0f0abd7a-ecec-428c-98cd-32aa2b3bc449
1bd1aff50c233b235e8a8d872896ebab36ee39ca,a0edb93b-1e95-4128-a295-6b1659149cef,2024.0,8.0,North Jon,4676-4687,Knowledge Discovery and Data Mining,d54b48eb-8ec1-4beb-b93b-7fd365c0271f
04068c2ad14e94ed98bc225ee74fce8df98a9822,c50b33b8-657f-4073-9058-bb7726302d92,2017.0,3.0,Sarahport,76-83,International Conference on Cyber Security and Cloud Computing,2cc7abab-ebcb-4fe0-a623-2f71a1a99453
b7b9248db942f44a626337813e4666e347c58ec8,3bc59e53-8413-4f2a-b739-d2b155898833,2019.0,3.0,West Cynthiaport,1-5,International Conference on Contemporary Computing,4905d20f-0954-472d-8e55-033e9e2b03af
4a6e11ad74add6eb09c9e12693b893497399806b,b6907ba5-9cb2-46e3-be2f-b35e0fd2ba61,2018.0,3.0,Wallburgh,422-427,International Conference on VLSI Design,4f1390b2-999b-4488-a348-fa19b1320386
04dd0bde82bca33751e6a6e11c2bddf5a4f6d029,e1afedcc-2543-4f61-b797-bc52344438e7,2020.0,3.0,Jamesmouth,1-7,"International Conference on Social Networks Analysis, Management and Security",a3fbcd07-d6e3-4719-8c95-b50b5f53571f
75d896babbbf9a00bc3c4c4d7bebe757ed6f5c49,e07422f9-c065-40c3-a37b-75e98dce79fe,2022.0,6.0,West Amberview,,The Web Conference,9f9c40c0-1034-49ac-99ca-c216844cf587
d26eea5287e5a26a7a7f74d4e43444fdb662b9ac,63d63e9e-8717-432f-90cb-ce806be05cd4,2019.0,4.0,Port Paul,663-671,International Conference on Signal-Image Technology and Internet-Based Systems,9fe68f10-150c-4c96-982d-7871cee3c640
2014b6dd3b9456906ab37f9ad1e191452a07a46e,3b3de2d6-b889-4a6a-a93a-df4147cbcb4b,2023.0,3.0,Wilsonland,111-118,Student Conference on Research and Development,ac759ab9-684c-4e3e-a688-ce036069f158
cf890f0994fbcf2c6f57d881ffbad6b7d86a1fa6,22466e99-8720-4629-9169-4469e385e4d8,2020.0,4.0,Davisfort,1005-1008,IEEE International Conference on Emerging Technologies and Factory Automation,77298d3d-9050-4e25-84bc-1a4a6ac1fcdb
c8b4b5f2ade91d584df45f3e9177481c821577f8,4ee942df-8fd9-437c-a9a6-e82a7cfdfb33,2022.0,3.0,South Robertchester,1-6,International Conference on Data Science and Information Technology,18eefc2c-4fd8-4c4c-94ad-49640ed105f8
99bb775494644b52251f8c3dbbd4d4a615004a7f,47c47088-7640-441b-85ba-375fe8f5c3a4,2024.0,9.0,Lake Todd,1-7,International Conference on Computing Communication and Networking Technologies,21775910-8197-4d8b-ab5a-0fadac41c43f
1e088aa1f262fdf5b2339ae8d524f860c5b14c30,764e3630-ddac-4c21-af4b-9d32ffef082e,2024.0,12.0,Joestad,859-873,IEEE International Conference on Data Engineering,e2f793c6-eb39-415a-906d-5c4387aaab8a
80d4f9350fc0fa3b16bd3181b1d490ea524faa66,46990654-eb6c-4674-96bc-ba905dab2a86,2019.0,3.0,South Miguel,607-611,International Conference on Conceptual Structures,4d369177-d251-4123-85a3-f08e6ae48640
f92141b12c93cf11f149d6fdba20420c2e4e54a5,a966c5e8-76dc-45c0-942a-3c7e41ac9b1a,2024.0,4.0,Cameronfort,1764-1769,International Conference on Computer Supported Cooperative Work in Design,a58374ea-abcf-45a9-b2a6-d4f30aa0955a
548f5a06863828367f23f776c257266a579b7238,c56116d3-225c-47c9-a4d9-f935e32f846c,2023.0,3.0,Lake Vincentview,1-7,IEEE Vehicular Technology Conference,ce327f4a-871b-46f6-a3ab-c155b055ff61
6fabe9f87ce0187a9f3bec451bc089e88ffee576,b189dec0-41d0-4cea-a906-7c5186895904,2022.0,8.0,South David,3785-3790,Global Communications Conference,48f89bdd-f338-4683-8e02-e124935c1d8b
5e950e7fd594c7c6929fa2c4f545a4357f303df5,67d15a94-d523-4b5f-be58-03fe2ef9dcfb,2022.0,4.0,South Lindabury,111-120,Industrial Conference on Data Mining,fd5946ee-f2c4-47d0-89cd-dfd0881fb55f
522beabcb6e0a8bb5b6b6badfb4bd27071fe926a,0942fb86-c16f-4084-9902-10ddcfe18180,2019.0,3.0,West Taylorbury,,Micro,32b8547a-ae6a-4fee-bffe-e9dec71a90ac
b77ce0399bcd62e5e38cad47b7e6c8ff60333f39,b189dec0-41d0-4cea-a906-7c5186895904,2024.0,10.0,Jessicaberg,4196-4201,Global Communications Conference,f508fc91-4452-43ac-9145-b1f088990202
8214ce840899efb784a9b8adc2885bca12cc5e96,d03a5bfe-db75-4dc9-95f3-ae92b081f42c,2016.0,3.0,Ronaldside,175-184,International Conference on Utility and Cloud Computing,f948553a-c9f3-4fd2-8695-2f36b7f867b6
5bdea707bbfd0cc0a03bc650ea48f7b6de21be2e,18d0cd32-678c-491d-a7f9-126274365043,2019.0,3.0,New Natalieton,693-698,International Conference on Emerging eLearning Technologies and Applications,3fc0bb49-584e-4508-89ed-42af19469069
5f448aa0f3cbc9fd98911af4889e62c3c1370562,a9382755-e9fb-4e39-b66f-6456c9c5f8b3,2024.0,3.0,Jonbury,,BIO Web of Conferences,4a9a23d3-40f4-44af-bf97-a17edfd5f456
8e09f756da4c3844c308189c7b5de94cec038e5b,e29f3ae1-4574-4fd4-9f5b-498495cb7952,2017.0,3.0,Allisonshire,,USENIX Workshop on Hot Topics in Operating Systems,ccd17ef1-0505-4cd1-b75c-c9b329ab01ef
9f0ff5677d9a91a5981814e8bf25b4acb4524340,ba675c4e-f2dc-454e-9e38-d195732ed2b6,2018.0,3.0,Mercadomouth,1-6,IEEE International Conference on Fuzzy Systems,c66afb62-a4a5-4d55-b6c6-a92a6f05f477
6d82e54d404b3dfd794588818188a9148e542ed6,deedf64a-dd5c-4b33-b345-ff83bfb93d71,2022.0,3.0,New Matthew,,International Symposium on Computer Architecture,7a692ead-2878-4c11-a7b7-b18f4135013b
167adae4fb0318f2819f5df8d7d76b53ad2ef4e8,1124d164-490d-4da9-b0c2-ce8a8dc98202,2023.0,3.0,North Brianburgh,4997-5006,BigData Congress [Services Society],06ac4eb2-9eac-489f-93d1-7d92d3ccc3a5
abb9f6c10e5e01602980cf52f8f8ce6d1c3fe0c9,528ced1f-e949-4e1a-8fee-2ffbf0be551d,2020.0,5.0,Jonathanside,,Conference on Innovative Data Systems Research,eeffcbf6-dc76-4e5d-8c74-90096678e3a9
e6126678a7ee54786421d619dfd909c2eeafbbf5,764e3630-ddac-4c21-af4b-9d32ffef082e,2023.0,11.0,Meyerhaven,3688-3698,IEEE International Conference on Data Engineering,4e3e7b35-85a5-4587-b8af-74f3721b944c
b5ce5ae81038531ec5ea3ce9df80493b5231f56f,b7696878-9521-4592-8205-198d53528bd2,2018.0,3.0,Browntown,608-617,Euromicro Symposium on Digital Systems Design,ddde4817-2e0b-46e9-bd45-b372098a5cb4
06f3dace8a1da1ce203953c55da5bf71e1e20c4a,8c36c300-10f5-4008-ae53-6371fcc3030d,2017.0,3.0,Lake Heather,607-610,International Conferences on Information Science and System,a8660214-785a-4848-a921-ca0bc2d543e0
5575ec38f0c179bd538aed02d0fd36e663b8104d,d03a5bfe-db75-4dc9-95f3-ae92b081f42c,2022.0,6.0,Leeshire,151-156,International Conference on Utility and Cloud Computing,2be34137-9151-44a0-a241-86a84bf21e6e
a88528eaa15598134a81b2be5582a44d94753884,e50754cf-360c-4e22-a321-30a44fe1c457,2023.0,3.0,Whiteview,,International Conference Electrical Bioimpedance,79ccaf62-ee22-4ec8-b7ad-f6fd8aa8473d
5213e6f4403c7bddf62eca1cb1c4f5f89d6a38cf,ab066af1-bfee-42da-84bb-42f7e199d0d0,2022.0,5.0,Garystad,6640-6645,IEEE Conference on Decision and Control,63b034dd-d3b8-4d38-9a3d-69a2788efc69
380c289ccd7f1033f36a7ba6a380b30080fc539c,1bfd71fd-457d-4dba-a367-b837371c4831,2018.0,3.0,Harriston,,Future Technologies Conference,3a25498a-8828-4186-ab7a-cf4c38b4c229
04d8dd818a0da899a3af75d8635539766e131e98,49bb481c-95dc-4e09-a921-95f6c7f78ab8,2020.0,5.0,Gibbsmouth,328-334,Conference of the Open Innovations Association,3b5bd6a5-8370-4ad2-978c-6b50de154653
d93354c057956924addd5a957ba9ee4a1dde7360,fc0a208c-acb7-47dc-a0d4-af8190e21d29,2021.0,5.0,Schaeferport,,International Conference on Machine Learning,c40784e2-86d1-4708-b8e6-efbece11b8ce
10aad54cbed60ef78211750feacf59e5aed43ab3,8ffee4a9-9078-4b52-9e43-b5adb39f1f34,2018.0,4.0,Garrettborough,267-274,IEEE International Workshops on Enabling Technologies: Infrastracture for Collaborative Enterprises,9008acb3-853b-479a-bbdf-3b8431174e4f
073471cf36f7246e26c4fd765e8eaf7cb9e86d27,11e94c04-6b12-41c9-963d-1a08cdbc306d,2021.0,4.0,New Anthony,,ACM SIGPLAN Symposium on Principles & Practice of Parallel Programming,83e38287-9a5d-4c16-9865-e1585ad2e3db
64028d777e31cb18270379aaeb4da64260e381c3,ffe5bb5c-04ed-488e-985d-d3a7b39542cf,2019.0,4.0,Weaverland,164-175,IEEE International Conference on Distributed Computing Systems,8cbb697e-3247-4dc8-93a5-079701765601
0a0a32a9431cf0e3bf3db413df1e222aa4dc685c,b189dec0-41d0-4cea-a906-7c5186895904,2021.0,7.0,Robynton,1-6,Global Communications Conference,4fda8d84-9b93-4532-99b9-b6b308a982a1
e093cf5af9687850cc15bb10c39017ae5def934a,a25d5cf7-75bd-4479-8c50-5683f7d1d509,2017.0,3.0,Burnettside,1-8,Latin American Computing Conference / Conferencia Latinoamericana En Informatica,f2386a71-7b79-410c-8ca3-30d2508a80fc
8c2cca3d36ebe2b7a899954d63583c0ce9039af1,7bcf4c5c-f6c0-4f78-b561-806ec0f68d6e,2023.0,3.0,Kevinmouth,49-55,International Conference on Informative and Cybernetics for Computational Social Systems,7879092e-661b-47fb-ae9f-3658e734063b
e2da2f47ddf1f4bfde1e2d45f587fe4b63f9ea5f,4ee942df-8fd9-437c-a9a6-e82a7cfdfb33,2023.0,4.0,Escobarview,56-60,International Conference on Data Science and Information Technology,6b42a3e5-d25b-4290-9092-5311ffdf04d2
b3fbfc317c6a675427125c12e8fc19b0165888a7,406d9f60-417a-4dc5-a6b7-1fe4689a4ff7,2021.0,6.0,South Timothyfurt,600-608,IEEE International Conference on Cloud Computing,274b5e7c-9474-44c8-b3c6-c0dbf6aa5b9d
76c1063dd6f1b28a12aec65ecf8794984bcd000b,05173752-2c8b-4d3e-b2d5-81e27c400524,2023.0,4.0,Lake Adamfort,,International Conference on Service Oriented Computing,f9929acb-a403-4eb5-813f-b74154653981
c1f6ec97752a6e5fbaefc73bcba001ddf5868914,74f47cf8-2839-4a56-959a-524dd0ed9e3e,2023.0,7.0,Brandonmouth,839-842,International Conference on Extending Database Technology,18896698-4c21-4af8-a8ec-d3fd4f770fd1
4f4262e04d7199a437d82ddd02d4f9c90bf51f0c,7431ff67-91dc-41fa-b322-1b1ca657025f,2021.0,7.0,New Mary,,International Conference on Information and Knowledge Management,e65d5ac3-1667-483a-bbca-6e32b93ad284
c2c1172c89e22791eec421e889cb39cb0544b86c,45153c2d-728b-40e7-b147-2ac0912a916e,2024.0,6.0,New Noahside,1-8,ACS/IEEE International Conference on Computer Systems and Applications,506db7ba-a83d-4baf-a89a-d03c65758782
183350ecc01e1b4ed523db0147f557e4dd9aa818,092c8d02-6070-40a6-8cf5-5a24bb36507c,2024.0,3.0,Port Joseph,88-93,Wireless and Mobile Networking Conference,72130ae5-342d-4c59-a757-b2ccd29c8bb5
a1c13faf265d9cd7f83daea1ce79847e2bdec5cf,4cc151d1-e28c-4fdf-a570-77c73d5ab813,2019.0,4.0,Cruzport,1-4,"International Conference on Behavioral, Economic, and Socio-Cultural Computing",894bb810-3a62-4899-bf70-af38bd7a777e
52f1fadf46d49018ac0b31bae9e186117c079ec5,3bc59e53-8413-4f2a-b739-d2b155898833,2019.0,3.0,West Cynthiaport,1-7,International Conference on Contemporary Computing,4905d20f-0954-472d-8e55-033e9e2b03af
49395ab9ead40247f71a0b016a05cee97c9cbb2c,b63861a6-ab0a-47a4-9f6c-accf03b5a180,2017.0,3.0,Coxland,1-4,Iberian Conference on Information Systems and Technologies,45d4afce-c75a-4632-a003-7f1381351d26
607866aa2572df5b14488484704ff4ec10b0a8eb,094f3ff3-fb67-4573-9f00-0852f0409d13,2017.0,3.0,South Carla,161-167,International Conference on Smart Cloud,39d12dea-ec2f-4985-a2fa-1c094b9c2a71
1586c70a2e39d67f2ac5928647c241809881376b,764e3630-ddac-4c21-af4b-9d32ffef082e,2021.0,9.0,Port Davidfurt,396-407,IEEE International Conference on Data Engineering,dcbe51f5-79e0-47fb-ae2a-3569d3a9cc1c
1b62aa788ed602e5afb0b5aa09e6a0a9707cd7f0,27235614-bd3e-4d6b-be38-5ede18f4e209,2024.0,4.0,Lake Ashley,1-6,IEEE Wireless Communications and Networking Conference,d723f953-5e8a-4bc5-a62f-4ebd43b59570
1d434ae65664b49d57418d546e0839aed43fe282,9d83259d-8d79-4e98-a9e5-6237469bc057,2017.0,3.0,Port Loritown,1-10,"IEEE International Conference on Networking, Architecture and Storages",14f56778-5b87-4f20-88fc-2bbcaf4c7f89
656dd9554dad2e1751a866dfe231f16e03f0d6b8,66c268f7-ba60-443f-919d-e2c297910401,2023.0,5.0,Port Jack,1-6,International Conference on Computational Collective Intelligence,bbc51a4f-c626-47a6-b15a-7e812696d935
f2081326620275c61e799775965762fe601959b4,ec37ab61-bda3-4666-b030-93e91de580dd,2017.0,5.0,East Michaelfurt,2147-2151,"International Conference on Advances in Computing, Communications and Informatics",a6d1d0e9-d1e9-457f-952d-e0e40625e61a
9f765eb1220c95dc099f5c911ca2e268c2f05e85,45153c2d-728b-40e7-b147-2ac0912a916e,2023.0,5.0,Lake Amanda,1-8,ACS/IEEE International Conference on Computer Systems and Applications,2ba21445-123a-4148-ae60-a026471ee8bf
64c253b4bcbc9311353b63e1350cd79dc6a1ff00,764e3630-ddac-4c21-af4b-9d32ffef082e,2024.0,12.0,Joestad,1171-1184,IEEE International Conference on Data Engineering,e2f793c6-eb39-415a-906d-5c4387aaab8a
56f9f8342b23f6a3621613b21714944b9011e167,74f47cf8-2839-4a56-959a-524dd0ed9e3e,2023.0,7.0,Brandonmouth,144-156,International Conference on Extending Database Technology,18896698-4c21-4af8-a8ec-d3fd4f770fd1
e43272b6d0cf8c6bb5931c226dc5dd47cf88b0df,764e3630-ddac-4c21-af4b-9d32ffef082e,2022.0,10.0,North Jamesview,3675-3687,IEEE International Conference on Data Engineering,760ed92f-a592-406e-8d91-161eff52032e
c09e8c7c00350b76e58f9d122a25b86f3422ad30,764e3630-ddac-4c21-af4b-9d32ffef082e,2017.0,5.0,Toddberg,659-670,IEEE International Conference on Data Engineering,c07a0a2b-162b-4c55-a330-dc4a62641ec4
4eac0fca0e861e56f502f348c3c0e024e0960c42,764e3630-ddac-4c21-af4b-9d32ffef082e,2022.0,10.0,North Jamesview,2997-3011,IEEE International Conference on Data Engineering,760ed92f-a592-406e-8d91-161eff52032e
4d1aee93dc22b961ecc6f0073b714c0265864060,74f47cf8-2839-4a56-959a-524dd0ed9e3e,2025.0,9.0,West Raymondport,970-977,International Conference on Extending Database Technology,f73ae992-6dda-4ded-848e-7d6268d94e1d
204615e874c9c1358fe6461eb9eb4d2e36e5c595,86daa573-0639-4ad6-a9c9-eb62790ca310,2023.0,3.0,New Debra,366-374,"International Conference on the Internet, Cyber Security and Information Systems",ac163760-96a8-43a6-a64c-b165e1927477
697b8dd051c2627ff26ae5115edf63f1c9c8e975,764e3630-ddac-4c21-af4b-9d32ffef082e,2019.0,7.0,Peterstad,1537-1548,IEEE International Conference on Data Engineering,71dbf6ec-8eac-409a-8b5e-e5c6fbfb8744
c7108999545af0d2b9ae32c8834115f835af4295,2194778f-4fb6-471e-b2ff-5ad194635f72,2022.0,3.0,Hartborough,1 - 60,Measurement and Modeling of Computer Systems,a5c44e72-bd8a-46ee-9b52-50019843b63e
786b9a5e988db5d553a6ed8f86ae8cebe8967941,9d83259d-8d79-4e98-a9e5-6237469bc057,2017.0,3.0,Port Loritown,1-10,"IEEE International Conference on Networking, Architecture and Storages",14f56778-5b87-4f20-88fc-2bbcaf4c7f89
7e0dc66253b408c60b895bef0f43e318ebafe5a9,1b767051-ba1f-457e-bd23-1b483c7029c7,2021.0,3.0,Davidview,,E3S Web of Conferences,19fac3ea-b421-464f-8ea1-f0e6505181e7
473e881513180ae54c84135787b329ca1feef7e7,925b7d4e-af4e-4a09-9da2-f3237c258a9f,2020.0,4.0,Martinburgh,473-476,"International Conference on Intelligent Transportation, Big Data and Smart City",cf9eb054-2a86-4fdb-b367-e2fbea6f1a61
c7ead1d096c4dbcb66921eb88fa39cef3c882747,e23ca26c-bd38-43f5-b5e0-a169c90c6774,2023.0,4.0,Marieview,789-793,International Conference on Information Systems and Computer Aided Education,19c551b1-9bc6-4350-ad02-2a1e712290ab
2ca63daafe06b15a63186d7b821b52638d330e90,deedf64a-dd5c-4b33-b345-ff83bfb93d71,2023.0,4.0,Williamview,,International Symposium on Computer Architecture,b7478ba0-1fd0-47f4-bcdb-322c6915a552
7f714927f32b2005b7d4608f1a24a01f4c18e783,86c43745-31d9-4c1a-b33f-ce3aa0042dbb,2024.0,6.0,Raymondbury,,USENIX Symposium on Operating Systems Design and Implementation,980ab968-2e96-4a71-ab14-0177e39c3fec
89811212eaf52f78cac65d7eed70b149bd450f1c,97a677bb-0fa7-4c1d-a54e-24db1fb98dd5,2015.0,3.0,West Lucaston,782-784,International Conference on Computational Intelligence and Communication Networks,4d361dc3-43dd-48cc-b68b-4b25ae76fd10
9937c9498f296158ac0c6a861de4125b210a7191,f6752838-f268-4a1b-87e7-c5f30a36713c,2024.0,4.0,Port Elaine,361-368,International Conference on Machine Learning and Applications,367b4a9b-dcf1-4cee-9e73-77767409cdd5
66b786602e0d107eeed049070625398a8e239482,ab0ea0d9-ab60-449f-ac5e-9cbc0e3d5a6e,2018.0,3.0,Emilyshire,,International Conference Intelligent Data Communication Technologies and Internet Things,753ccd4d-924b-4ee8-a05e-4033eaf0a8a4
a4f68f5bd2d0d8eb0d32f29c06c71a43c4039f75,764e3630-ddac-4c21-af4b-9d32ffef082e,2021.0,9.0,Port Davidfurt,2547-2558,IEEE International Conference on Data Engineering,dcbe51f5-79e0-47fb-ae2a-3569d3a9cc1c
5845e3da58dbdf7635f68e59de778ea6fbf04874,a00a1a4f-16c6-4360-a8b3-a3f88d2fe78f,2020.0,4.0,South Matthewview,,ACM-SIGPLAN Symposium on Programming Language Design and Implementation,5cc146b2-3392-4210-b89f-ca10b78bf8b6
763e0eada0cc9045551fa89ade1d79ba9057795e,29df4b17-9a16-4a4c-94a6-002f52e628b4,2021.0,6.0,Ashleyburgh,,International Conference on Parallel Processing,ba98d391-386d-4397-ac96-1b3d1e199456
ee2e7d12787458f960b457cd2c7df79ca8001797,021b37d3-cef1-4c12-a442-257f7900c23d,2023.0,6.0,Clineburgh,1-6,Design Automation Conference,dba5795e-2fa9-448e-8df2-c5e4b3c98336
66c4ca9b3bcf3e73c0c232af9fd4ad235f71fe5c,7431ff67-91dc-41fa-b322-1b1ca657025f,2018.0,5.0,Rodriguezshire,,International Conference on Information and Knowledge Management,cd849064-42e9-430a-ae29-c993983de4ef
adf881fab7b5331cc1e09d66bfc78a02b18c5a86,0d6f7fba-7092-46b3-8039-93458dba736b,2024.0,11.0,West Micheal,7705-7709,"IEEE International Conference on Acoustics, Speech, and Signal Processing",436faabb-cb10-46e2-abbe-ba6609934700
12f7e284a445b0cfaf89659d30e55573f53e64c5,d6283871-df25-4880-9c85-46e9830f0d22,2020.0,5.0,Patrickfort,364-368,"International Euromicro Conference on Parallel, Distributed and Network-Based Processing",ce0ef268-fdd0-45de-a7f4-94cf93c8ea92
49cd4fa1909e3a7a3902e7b6854c2fa1bb2e23bc,67f7f831-711a-43c8-8785-1e09005359b5,2022.0,5.0,New Billland,1916-1922,International Joint Conference on Artificial Intelligence,aee40e04-86a8-4c34-985f-22f646d2b136
62a4e5ffcd29478bb29edbd71220f7c3b46403ea,0c1420a4-aa9b-44f9-b264-ba3ac5c37050,2024.0,6.0,New Joshua,1-15,"International Conference for High Performance Computing, Networking, Storage and Analysis",88009f3b-22bb-4886-8d7e-ea5bf5a1627f
455667c13187917e8930255dc6ceb8c9bca43007,6c6fcaa9-fd25-488b-8050-995227ac671c,2023.0,4.0,Lake Jamesland,,Symposium on Operating Systems Principles,9e7e6d46-dcfb-408e-b7b4-3b0bdb7dff25
3f1b0bc729e257e481c9c0b6cb3ed828f64d35bb,7cd7bf33-3c9a-4b3f-8b1a-177673c6ca73,2023.0,5.0,East Davidberg,188-193,Consumer Communications and Networking Conference,05674f1d-a4fa-4064-90f8-32cbd1e6fe79
08c05f86b4528144c1d90f49ef16149fe88562e7,b189dec0-41d0-4cea-a906-7c5186895904,2020.0,6.0,New Jennifer,1-6,Global Communications Conference,8a70eed1-3165-4c9b-8ba4-20bbb33db29b
29ff8b41bcee1fbfdb0a5c6baf9a10f4cf0ade9e,ecd69639-52a0-4d29-af57-21bca9e0a66b,2020.0,4.0,New Shannon,635-639,IEEE International Conference on Industrial Engineering and Engineering Management,358ec5b4-5387-4328-be01-3407f18b74ab
