paperId,venue_id,year,edition,location,pages,new_conference_name,editionId
6fd56aefd6e0cf0f2f74f0f8bf8d9d5fd2146da1,5a284490-40a3-4a14-a5c1-51a423dffad6,2024.0,3.0,Williambury,54-67,ACM International Conference on Embedded Networked Sensor Systems,2daf4a4b-f14d-449b-b9ea-f59a9604fe6e
6e49056478dbe8078dfffe7bbdaa8d4379c1b139,47c47088-7640-441b-85ba-375fe8f5c3a4,2024.0,9.0,Lake Todd,1-6,International Conference on Computing Communication and Networking Technologies,21775910-8197-4d8b-ab5a-0fadac41c43f
91f97928914f4e086206c82efb32890e7f438f67,60c45ccc-5528-42eb-85a9-7606a3d9b220,2020.0,4.0,Josephshire,,International Conference on Interaction Sciences,21926752-261a-47a3-baa2-f7310d1d9090
a04976b49de86908cd6576942c9bfb1be0796bf1,1d8d1e5b-972b-4809-bf00-64e9da59fdb2,2024.0,3.0,Cynthiastad,1-6,International Symposium on Computer Vision,815531b2-ff2c-4663-a458-4b91ef5b4971
b8fa0ed0555c38deb434fdc246ec511af3818edd,809f6dd1-7dd8-4d79-a46d-4726c3a67128,2021.0,6.0,Josephburgh,,European Conference on Information Systems,6e0fd4fb-8c75-4f3d-aada-58671ccd6dbb
d98f460a87ce8ee682ce3dfa1aae20773672f2f4,6363ebc9-706a-4203-b804-148cbf8810ce,2023.0,9.0,Port Travis,2125-2128,IEEE International Conference on Bioinformatics and Biomedicine,d5475651-5feb-4a7b-a596-2af2a93b98c0
7a379b8167d839c3c16b0871cf26dc76785e133b,6190896d-fefe-4852-946c-33759039973a,2021.0,4.0,South Paul,1202-1208,"International Multi-Conference on Systems, Signals & Devices",4bd12425-6512-400d-8824-af58710fcf41
0b7696a5cf30de1c80ef40c79c773ff6fb12a683,d7d7587f-a1e9-46a4-9db5-54c95787c6f1,2020.0,5.0,Sheppardchester,5851-5855,Annual International Conference of the IEEE Engineering in Medicine and Biology Society,1d6cd3db-13bd-4088-8483-7217e32d71b0
13b4243fa5658b363c75d8faffaab8021bcb1c18,41929b26-d887-42cf-97f1-1217a0a9e315,2023.0,3.0,Ashleymouth,,"ACM SIGMOBILE International Conference on Mobile Systems, Applications, and Services",fdeb3976-0293-4836-b162-8bf4fcfb2bee
211a328e49e363037f8790ade8c2b5e70e0cc27f,b55b50b1-aae7-47a7-b042-8aecc930073d,2022.0,3.0,South Donald,,International Conference on Human Factors in Computing Systems,00a2225c-3a16-4867-914f-354bb11b069d
4c726f4c3c644d38860af0f00e9b5998f19ecb72,b6369c33-5d70-463c-8e82-95a54efa3cc8,2024.0,4.0,East Mariastad,,International Conference on Information Photonics,947f1870-022f-4618-8f23-68e730798dbb
75ba97f1d8e7305671f6fd2dd36a720989a82aee,a2f3e710-3f36-46fc-bf88-c40f1356cd43,2017.0,3.0,Gonzalezton,1-4,Canadian Conference on Electrical and Computer Engineering,6be274ce-7849-4f0b-9936-1626c9f9e027
592d063a12fd99a5e1616ff2438f3fe574cda29b,d1ccff36-fb09-45ac-9078-cb0225b06c19,2022.0,3.0,Kathybury,1-4,Impact,07c9a8ad-bcd7-4c65-98fa-020cc190ff5a
46147590f9bd1b86f467e61c856f452586bff2d6,1666219b-23e8-4300-acf2-d044d744a3f7,2024.0,4.0,Jenniferview,1-7,International Conference Control and Robots,0a8e8369-f14d-49b4-9685-3a473b6d635f
519e721b675550cbdb70323b26e4b0098a721fa8,47c47088-7640-441b-85ba-375fe8f5c3a4,2024.0,9.0,Lake Todd,1-6,International Conference on Computing Communication and Networking Technologies,21775910-8197-4d8b-ab5a-0fadac41c43f
27b838f9a741c43da40d71f9c8be3f8cfe651014,8dff82c6-607a-4f61-9efa-a66d43226f8f,2023.0,4.0,Kentville,214-219,International Conference on Communication Systems and Network Technologies,a1c0a6e5-5e15-423f-b3f7-5c2378ea7c40
f9420125089c2df692aa919bc1d3125d46e3c5d4,809f6dd1-7dd8-4d79-a46d-4726c3a67128,2021.0,6.0,Josephburgh,,European Conference on Information Systems,6e0fd4fb-8c75-4f3d-aada-58671ccd6dbb
871193857871e0b871175f8f5e6e61216e43594a,0d6f7fba-7092-46b3-8039-93458dba736b,2022.0,9.0,East Jasmine,1-5,"IEEE International Conference on Acoustics, Speech, and Signal Processing",0486c79f-d23a-4fc9-baa7-3ed4b2aeeb86
8ad568af79a05ec682e38079c26e02c53001747e,6363ebc9-706a-4203-b804-148cbf8810ce,2023.0,9.0,Port Travis,2332-2337,IEEE International Conference on Bioinformatics and Biomedicine,d5475651-5feb-4a7b-a596-2af2a93b98c0
31727aa453b1b83f0639e7c6bead508b40abb5d6,8dce23a9-44e0-4381-a39e-2acc1edff700,2022.0,3.0,West Kathymouth,,Annual International ACM SIGIR Conference on Research and Development in Information Retrieval,73445bba-85c7-4905-8c99-f861aa2c9097
8f8c40f8e3d41f576533f0b20d61944a3f4128ed,69abe422-ea90-45e0-a2e2-3aa1f126bf22,2018.0,3.0,Andrewburgh,1-5,National Conference on Communications,4dc5910f-cc00-4e37-81fc-38781c9be6bb
67ab3e84895942e62a5e50d09f1931f50afbed34,5aca6456-76d5-4208-84d8-a6b60228b52b,2023.0,5.0,South Jonathanstad,2354-2361,European Conference on Artificial Intelligence,c0c60f66-0c77-43e9-8e01-b5b05514b519
f63648bde384c35b96e0dffb0b9d26e4316d0220,af941ce7-e210-4891-93b2-3d5154cc37e9,2023.0,4.0,Brookston,232-236,IEEE International WIE Conference on Electrical and Computer Engineering,d9a34c01-81aa-4c75-8e70-5ee710862774
ef5d6f9b4220c5c55d4ad30a2820db938203160b,1124d164-490d-4da9-b0c2-ce8a8dc98202,2023.0,3.0,North Brianburgh,4843-4847,BigData Congress [Services Society],06ac4eb2-9eac-489f-93d1-7d92d3ccc3a5
43d9b2c31f5e80ed0948ee460fe452cf223b6ab4,b55b50b1-aae7-47a7-b042-8aecc930073d,2022.0,3.0,South Donald,,International Conference on Human Factors in Computing Systems,00a2225c-3a16-4867-914f-354bb11b069d
a573893af6fa5e26994c39be86a31f4cd8e7e92b,f80ba4a3-7aed-4021-b4d8-e4f50668847a,2018.0,3.0,North Rick,1-8,IEEE International Joint Conference on Neural Network,814fe3dc-3118-424b-bee9-4f7c079941c4
8aa69a6f0cbdc2ed4f09f59c790a9a0eaa775d24,41bf9ed3-85b3-4c90-b015-150e31690253,2021.0,4.0,Martinezbury,843-853,Conference on Empirical Methods in Natural Language Processing,8284847e-f62a-4bad-ab46-92819dfdbf03
19636d9b43fc0baa0aa8e5e4cc5aa52306e50805,47c47088-7640-441b-85ba-375fe8f5c3a4,2024.0,9.0,Lake Todd,1-5,International Conference on Computing Communication and Networking Technologies,21775910-8197-4d8b-ab5a-0fadac41c43f
5495a148cb4b0016a3a043499427160c6b9dce10,47c47088-7640-441b-85ba-375fe8f5c3a4,2024.0,9.0,Lake Todd,1-6,International Conference on Computing Communication and Networking Technologies,21775910-8197-4d8b-ab5a-0fadac41c43f
9d25bc54bca5f0ef76f799ea86a399c3bdb9d00c,d7d7587f-a1e9-46a4-9db5-54c95787c6f1,2023.0,8.0,Christopherfort,1-4,Annual International Conference of the IEEE Engineering in Medicine and Biology Society,e660000e-d739-4ac1-a3ed-25923aa7f5d6
172c48064167adcbaa5e102c4dbe5cbbb97bb07a,6336131c-2f71-4f61-bc3b-1bf31ec9fa3d,2023.0,8.0,Melindaton,1222-1225,International Conference on Computing for Sustainable Global Development,7df30e45-2bd3-4352-a71e-e477bf70c415
f991d74cf5c2ef3958ba1a13db939fccbfce034a,47c47088-7640-441b-85ba-375fe8f5c3a4,2024.0,9.0,Lake Todd,1-6,International Conference on Computing Communication and Networking Technologies,21775910-8197-4d8b-ab5a-0fadac41c43f
69cf0ae8e9c326813560dd6c7021cc6cdd684c43,da18ef0b-933e-4678-b2fa-4290baf6970a,2019.0,3.0,Williamstown,26-30,"International Conference on Communication, Computing & Security",3899c0d3-d0e8-484b-af5a-fbfd3cbd9bae
3ba06b883e50bc77272f8e952b9af186c5bc734d,838325ea-4fed-4f41-bf9a-7b569d3700ab,2009.0,3.0,East Michael,211-216,"International Conference on Power Engineering, Energy and Electrical Drives",d2a1f19a-5a1d-4c78-8258-54aa49f12e0f
215f993a5239724c36dbf1f9d7effe738230cbdf,7b6a98e2-3c5c-4a3c-a790-8b0256f0c569,2022.0,3.0,Lake Laura,1-6,International Universities Power Engineering Conference,2e42e71c-9c18-425d-b601-47deceab3b7e
f527f4777fdb5aad888a77c46f9417f92217f842,37275deb-3fcf-4d16-ae77-95db9899b1f3,2024.0,3.0,Port Marcoberg,8563-8570,IEEE/RJS International Conference on Intelligent RObots and Systems,5ee9556f-2c64-4840-8a2a-0af335ce494b
43b688f7de2a9002ee340ce92c62996386a5fb30,87739c1f-6199-4545-b7e6-4fa8d0af534e,2022.0,3.0,South Allenbury,1-5,"International Conference on Service Operations and Logistics, and Informatics",7f5b5cd4-9b44-46dd-8f2a-7e88c03f8c44
76d688dac9817f2f401e136d1e831c0ec9f9b9f5,41bf9ed3-85b3-4c90-b015-150e31690253,2022.0,5.0,Lake John,560-570,Conference on Empirical Methods in Natural Language Processing,20fada34-727c-4ec2-bac4-664c5d723b01
11c438cfdf3d323ca969314f6402bec90fd9ddcd,8bae9e1d-2df9-4ece-99bc-4e68368d40f2,2023.0,4.0,Amandaview,1-8,International Conference on Advanced Computing,5eb57050-5e5c-417f-9748-20dc989a98e5
1c0a2b6ae08632d770f317aaccaf269fa692e921,1666219b-23e8-4300-acf2-d044d744a3f7,2024.0,4.0,Jenniferview,1-5,International Conference Control and Robots,0a8e8369-f14d-49b4-9685-3a473b6d635f
705bd7cd17b68980f5d10e2d8d84df2bda912f2e,d0d8b615-5903-4da5-bfdf-4c06972ccf7a,2023.0,4.0,Lisaborough,628-632,International Conference on Innovative Mechanisms for Industry Applications,52e4c383-84d7-49ad-bf51-4f443097ac5a
de334fbcb82d2f8e2d32a5443dd9b0b1bd3656f8,4a0a181c-3807-4883-8ac2-b0ddf5f46497,2020.0,4.0,Johnstad,889-894,International Conference on Communication and Electronics Systems,5e1a45d8-f44e-4355-a32f-6f201327e648
e7428aa16a2fcb088d023bf5ab86de7a57aed34c,47c47088-7640-441b-85ba-375fe8f5c3a4,2023.0,8.0,Johnsonport,1-7,International Conference on Computing Communication and Networking Technologies,6a22c83b-720c-40ac-b127-cc752fb18085
fdcffd9d14ed1a1d9ab39eed8250f58f7839919d,41bf9ed3-85b3-4c90-b015-150e31690253,2021.0,4.0,Martinezbury,4566-4575,Conference on Empirical Methods in Natural Language Processing,8284847e-f62a-4bad-ab46-92819dfdbf03
ceae81335b52e04046fddf900e71ecf15301666c,47c47088-7640-441b-85ba-375fe8f5c3a4,2024.0,9.0,Lake Todd,1-5,International Conference on Computing Communication and Networking Technologies,21775910-8197-4d8b-ab5a-0fadac41c43f
0408f29939a50ad2a9cff5b4f53848302cb7a4ca,51227d50-1d22-48c8-ac32-5466d5c3d16b,2022.0,3.0,New Mariahaven,1347-1351,SMART,159ede0e-384c-4659-8904-cdc1ca758f0d
4b9f3baf58598141eec54bedec4bf1ea57a17b9c,070a8b94-9234-4a39-bff0-23e0c6b74464,2012.0,3.0,Lake Carolyntown,298-315,International Conference on Statistical and Scientific Database Management,f31bda24-e03a-46cc-8f15-a73cb155d589
d3c3280e4e91632395e8c9523c91d2972c03fe73,41bf9ed3-85b3-4c90-b015-150e31690253,2022.0,5.0,Lake John,5436-5443,Conference on Empirical Methods in Natural Language Processing,20fada34-727c-4ec2-bac4-664c5d723b01
e101b2abc5bb48de67f560449745bdc5c7e408ea,d7d7587f-a1e9-46a4-9db5-54c95787c6f1,2021.0,6.0,Leeborough,2964-2967,Annual International Conference of the IEEE Engineering in Medicine and Biology Society,7664ed99-bc0c-47e1-8152-a50e6143ac81
2ca0f49654a785baa325929cf34498225cf9138a,6336131c-2f71-4f61-bc3b-1bf31ec9fa3d,2023.0,8.0,Melindaton,885-889,International Conference on Computing for Sustainable Global Development,7df30e45-2bd3-4352-a71e-e477bf70c415
1d9baffbc88dd1d14146a3963fc2cab84c9501ce,47c47088-7640-441b-85ba-375fe8f5c3a4,2024.0,9.0,Lake Todd,1-6,International Conference on Computing Communication and Networking Technologies,21775910-8197-4d8b-ab5a-0fadac41c43f
1b4ac29a08b2272bd6b3fbf293544816e9d31c5a,f80ba4a3-7aed-4021-b4d8-e4f50668847a,2022.0,5.0,Patrickfurt,1-6,IEEE International Joint Conference on Neural Network,041fc326-8a49-439d-aa9f-78acb6685ce9
c06f55ab99a8c2a206a7a673d276cce7027c2154,47c47088-7640-441b-85ba-375fe8f5c3a4,2024.0,9.0,Lake Todd,1-7,International Conference on Computing Communication and Networking Technologies,21775910-8197-4d8b-ab5a-0fadac41c43f
f66c846471ddd711064e7f6a0fdafdd8f5eb319c,47c47088-7640-441b-85ba-375fe8f5c3a4,2024.0,9.0,Lake Todd,1-7,International Conference on Computing Communication and Networking Technologies,21775910-8197-4d8b-ab5a-0fadac41c43f
bef009191c0c763383d8138fcbf1a8b9c4b93bd4,0cb0dcea-43f4-4a34-a1c3-ac211434f660,2020.0,5.0,Robinsonhaven,838-843,International Conference Computing Methodologies and Communication,45ec0159-dcba-4ab7-9a17-2b39bfe9cf2b
830476f99774b5c14490e9efbc9848d458d3ead0,8c75e6eb-e194-4c70-922f-623ee68bb497,2024.0,3.0,New Thomas,1-6,International Conference on Advanced Infocomm Technology,64d0af87-97ec-4e49-b187-a6ef94c269f1
cc7eef82847cc5dd8fb4ccb2738284a878d595dd,8c7fd839-36e4-4261-a5c2-846c243dbbb5,2024.0,3.0,East Meghan,1-8,International Conference on Pattern Analysis and Intelligent Systems,981750e9-9f19-4b2e-bea6-93ffbc6c1a36
62b5485bd8a37670438d6cbfe4edd370839508d6,60c45ccc-5528-42eb-85a9-7606a3d9b220,2022.0,6.0,Teresafurt,,International Conference on Interaction Sciences,df7b5d5b-ae48-44be-9c53-f2c781eed79e
580f93aa3ddb6c55a0b663ef68333d84a22cc9fc,60c45ccc-5528-42eb-85a9-7606a3d9b220,2023.0,7.0,New Bradley,1-6,International Conference on Interaction Sciences,53fafd31-2296-4699-8b0a-ebb80fd6960b
3f7720d059892c2e18921d255f8b169bcce95641,6358253c-7d52-4c0c-9e03-4acfaad1bd74,2024.0,3.0,North Mary,90-95,Discover,e3a93dea-1849-47b4-b85c-eb2e4691b7cd
865f7adbcc6531729a232f3ee4ba19344f19320d,a30271f2-1619-44e5-a1fb-b1c91b224898,2020.0,3.0,South Wendyberg,1-6,Image and Vision Computing New Zealand,ee24d741-5ba0-411d-8653-9dafb48caebd
0f0cfe09c3e31c8ed57858858c0cae50d9f794cc,33972815-e17a-4d6d-af1c-5417cb2fabb0,2023.0,3.0,North Davidland,1-7,International Multi-Topic Conference,1a507cb6-2182-4b63-aa3e-f995dff499d2
17de8feca22a4e7ce33f1bcb59b37451122fb182,6d2e7607-dbff-464e-b89f-54b8b7785b1b,2016.0,3.0,South Steven,174-177,MS,ed73bb3a-d762-4f5c-80ec-74fadd72d95a
f34319ef82dd533a609b9d6c9f17a824b60a263a,d17c802c-e89b-4bcd-81b1-22f8921283fe,2023.0,4.0,South Stephanieborough,1-6,International Conference on Signals and Electronic Systems,f1a230a0-2d15-4cce-aaed-6bec100b1e03
2be07a9de7ae271db0c197b09b0ce007948c80d0,8ba4a725-4a85-42ed-9476-46e9112d63f2,2020.0,3.0,Rodneystad,74-77,IEEE International Conference on Condition Monitoring and Diagnosis,146ec542-f860-498a-8260-68d130e2291b
5919dc303ece5635de04889d557579306338fb2d,72b1619c-55d6-4f98-9218-23cd8aa74091,2023.0,3.0,North Grantside,30-34,"IEEE Uttar Pradesh Section International Conference on Electrical, Computer and Electronics Engineering",746a8251-2a9c-4caf-9f5f-d94b2f06575b
63351b9c8490f9673ae875bfc5832071e7378c08,72017ba4-9cc9-45cc-89cb-ced49936b1c0,2020.0,5.0,North Deniseton,185-189,"International Conference on Computing, Communication and Automation",84aaa191-49c6-4de8-b2c4-046c49d16b76
88fac4833a25819e426e854454a964990b21b39d,b364caaf-d684-439b-bff1-0dece7f87033,2024.0,4.0,Andersonbury,1-6,International Symposium on Image and Signal Processing and Analysis,52935035-626a-46f8-9e40-4e494411217a
493fdf6896f3be3f08717db2bda3d7415579d367,6363ebc9-706a-4203-b804-148cbf8810ce,2024.0,10.0,Jodiberg,6678-6684,IEEE International Conference on Bioinformatics and Biomedicine,a66e9cd8-ab39-4778-a124-9ffe1a808de0
482ab3467b4c3da56d9d365f54e3e0d9afb0cd97,a966c5e8-76dc-45c0-942a-3c7e41ac9b1a,2024.0,4.0,Cameronfort,2937-2942,International Conference on Computer Supported Cooperative Work in Design,a58374ea-abcf-45a9-b2a6-d4f30aa0955a
17c3d42f210564945cccf4ab7cc0019aae1649c7,1e33b3be-b2ab-46e9-96e8-d4eb4bad6e44,2023.0,5.0,East Peggytown,12966-12978,Annual Meeting of the Association for Computational Linguistics,b7788216-2269-449f-9186-fc621661d8bd
49967910e7c00cde2230b4513a3887569f37e6d9,47c47088-7640-441b-85ba-375fe8f5c3a4,2024.0,9.0,Lake Todd,1-6,International Conference on Computing Communication and Networking Technologies,21775910-8197-4d8b-ab5a-0fadac41c43f
6ca4c2f49f19bb30375ebfcb9de31bcc47944dd8,764e3630-ddac-4c21-af4b-9d32ffef082e,2023.0,11.0,Meyerhaven,3093-3105,IEEE International Conference on Data Engineering,4e3e7b35-85a5-4587-b8af-74f3721b944c
a159aae518799b3ad2e4d41696198b1901ca23d8,36949878-72e1-4ce8-8c7e-444cf4922345,2019.0,3.0,Port Dean,182-187,Computer Science in Cars Symposium,199ffca4-2d84-41b6-a8e6-aba8377c1e90
ac5c708bb30af98dfee54facad04c3378f7c29e4,680ae59c-60f6-4b3f-baa0-f7e895a8e578,2022.0,3.0,Garciaside,167-171,Information Technology Trends,595a97b1-e1b3-4a25-aba6-f102aadec723
7d97ab1a22a7a74cdfc8d2641c71078d7a1cc32d,b1846822-6c7a-4679-979a-246fbd7388c3,2024.0,5.0,Lake Briannastad,1-6,"International Conference on Information, Communications and Signal Processing",28425e87-33ff-41e8-ac1c-b4a96d4af122
08fcb21c7686ef4d085f22809f2db56291a8ea2c,2e7913cf-49f3-4c19-9a51-68860c6d73f9,2024.0,4.0,Youngbury,60-66,IEEE International Conference on e-Business Engineering,85abcdcd-74dd-4a97-8133-1746f446642b
1aed794f5a5d1bc510163a1c94e2af81d57ae232,6cbed6ad-fb46-4c9a-8477-75227ff3a47e,2023.0,4.0,Reidburgh,458-465,International Conference on Blockchain Computing and Applications,f58dd7f8-8556-4394-b558-c8b6394c7377
fa29e1527b81ccecb883b81754bcdd2b09a47965,22466e99-8720-4629-9169-4469e385e4d8,2019.0,3.0,Lake Josefurt,1155-1162,IEEE International Conference on Emerging Technologies and Factory Automation,d837135a-eea6-4c0a-ad9e-0ffdbb395f44
bedc0acc3d54f7e1cc896fb031ac3cbf95c6e5ca,1e33b3be-b2ab-46e9-96e8-d4eb4bad6e44,2024.0,6.0,South Terrimouth,11116-11141,Annual Meeting of the Association for Computational Linguistics,f4248227-62c2-40a5-9a89-3473825a98ee
45207acf2a4c649f324d3ed4bf6908022b0f7a1a,18cb41bf-d23d-4c47-a30d-3f1ef6abfb1b,2023.0,3.0,Lindsayview,1-8,IoT,44958ad7-a8e0-4198-bfe9-929f2c7197c7
db25310870739af8b50101010576e9a3eb2c7931,e574da12-4e4c-4b78-a203-ae3719c0c4f7,2019.0,6.0,Brandonville,513-522,Annual International Computer Software and Applications Conference,3f9eb62a-183a-4317-9f9e-caf9fc12a457
4e506feb12b57a32134fe41b38b22d07b32ffa11,764e3630-ddac-4c21-af4b-9d32ffef082e,2021.0,9.0,Port Davidfurt,2571-2582,IEEE International Conference on Data Engineering,dcbe51f5-79e0-47fb-ae2a-3569d3a9cc1c
b565394952065c37345fb75fb66e84709b6402a3,f6752838-f268-4a1b-87e7-c5f30a36713c,2024.0,4.0,Port Elaine,1669-1676,International Conference on Machine Learning and Applications,367b4a9b-dcf1-4cee-9e73-77767409cdd5
68f1e91df6524a3ca415fbb559ec9a7f52e974dc,764e3630-ddac-4c21-af4b-9d32ffef082e,2019.0,7.0,Peterstad,1238-1249,IEEE International Conference on Data Engineering,71dbf6ec-8eac-409a-8b5e-e5c6fbfb8744
365dbedf67991cedd19b3326e945c5489340ef5e,a0edb93b-1e95-4128-a295-6b1659149cef,2024.0,8.0,North Jon,6025-6036,Knowledge Discovery and Data Mining,d54b48eb-8ec1-4beb-b93b-7fd365c0271f
01ea16684c789a4cc55aa3371c6282b597abc203,0e6e8f0a-455b-4be7-9d4c-5d6f93bd25a8,2016.0,3.0,New Wayne,23-32,IEEE International Conference on Engineering of Complex Computer Systems,a80949ed-d045-4866-8a21-7ae20ee5c0b9
db85708f946faf268ace25f827702556addac58f,406d9f60-417a-4dc5-a6b7-1fe4689a4ff7,2018.0,4.0,South Brian,836-839,IEEE International Conference on Cloud Computing,ee21d237-11c9-4ff5-aa6f-450c4cbe0de9
90e088c8d0430c6f7dbb2dd7289a2dec5c10bdb2,74f47cf8-2839-4a56-959a-524dd0ed9e3e,2019.0,3.0,West Daisyberg,674-677,International Conference on Extending Database Technology,b417a832-1b32-4e58-bdf5-ad98a1669cd4
7d1b1ff104839c2760adec642ffa01a757e89f34,8270ced8-ed85-4519-9ef7-bf1c9c316434,2017.0,3.0,Milesborough,196-201,Conferences on Next Generation Computing Applications,6946fb0d-d821-4a13-a264-60142b078d59
c4284b54f6da4d41aacd04e4f0a04907ce5bebe1,6c6fcaa9-fd25-488b-8050-995227ac671c,2023.0,4.0,Lake Jamesland,,Symposium on Operating Systems Principles,9e7e6d46-dcfb-408e-b7b4-3b0bdb7dff25
d7bcac11768bb3d1bb03f5fe579d917fabb4837e,1124d164-490d-4da9-b0c2-ce8a8dc98202,2024.0,4.0,Kimberlytown,8831-8833,BigData Congress [Services Society],0a8919a2-b48c-4973-9843-145c606a30e3
e2209cad8e5496aa2451d400fe486b15ec54cf0c,8a31511d-7523-41b6-8d81-565373827b19,2017.0,3.0,New Albertborough,1466-1470,International Conference on Systems and Informatics,c5b87374-ca43-4afe-929d-7219d1d0d12a
7b4c7187fb749f74861d7f8941517f71fee6539e,9181819e-530e-4408-9917-93c5f58d7fce,2023.0,6.0,Edwintown,842-845,International Congress on Information and Communication Technology,0b9fda76-c9a0-482f-8e07-04b8b488bf9c
de0aac0b17c82d91afa5d7527b9080897be9be20,45153c2d-728b-40e7-b147-2ac0912a916e,2019.0,4.0,Lake Tiffany,1-7,ACS/IEEE International Conference on Computer Systems and Applications,090fc0f3-f296-4c06-9143-2f5432dfaeac
00209e4a681118b5e56b4cd029183166af5114dd,e07422f9-c065-40c3-a37b-75e98dce79fe,2024.0,8.0,Shannonshire,,The Web Conference,c889c85f-6f9c-467d-8177-e03e256d0538
d8cccfabbbab00d67c17361426dab736b30386d3,d4610af5-85e0-480b-8773-5c71d92a7b99,2023.0,7.0,East Darrylfurt,,International Conference on Architectural Support for Programming Languages and Operating Systems,7da53faf-36e0-4416-9bb6-9bd0f50c2837
4c0e91e6e8349f462d529d950a41c489427a22e2,764e3630-ddac-4c21-af4b-9d32ffef082e,2023.0,11.0,Meyerhaven,408-422,IEEE International Conference on Data Engineering,4e3e7b35-85a5-4587-b8af-74f3721b944c
7d89110f5603e38d3fd4866b484647a5fafeea10,764e3630-ddac-4c21-af4b-9d32ffef082e,2021.0,9.0,Port Davidfurt,2063-2068,IEEE International Conference on Data Engineering,dcbe51f5-79e0-47fb-ae2a-3569d3a9cc1c
f7c55cc748a7d6e4443faf5b52dd7eb88021b8f4,4f02ac59-1046-4afe-981b-6f33122b2014,2023.0,4.0,Debbiemouth,20-27,Swiss Conference on Data Science,ea57ac13-f9ba-49e9-baa2-d89b503baa40
dff0e6b1b327ab13be7ef42bbb2567c94d551f95,764e3630-ddac-4c21-af4b-9d32ffef082e,2022.0,10.0,North Jamesview,3699-3707,IEEE International Conference on Data Engineering,760ed92f-a592-406e-8d91-161eff52032e
3fa34e49ad939035dff06bdcdbf895e04f3d36a4,79ad93e3-8152-45a5-a97c-d6c327592c09,2023.0,3.0,North Adrianamouth,1-7,"IEEE International Conference on Electrical, Computer and Communication Technologies",67b30bb7-3a09-4c2f-90a2-27fd4ec0fc27
40185a1e6f1eeb5311c14136f2a8ee51420bfeb8,41bf9ed3-85b3-4c90-b015-150e31690253,2024.0,7.0,West Dianefurt,686-696,Conference on Empirical Methods in Natural Language Processing,6e15ce2f-dbc2-4511-af72-c1526d1a285a
cb6b03fd6e80ff46f915fc7c0e6649250c1e162b,7fbf5fc7-3fd7-4c0a-bebd-fd82ef6ec9f3,2019.0,3.0,Youngmouth,161-166,Industrial Cyber-Physical Systems,25149804-bf1d-42c0-a600-0fe7c04e4f0a
65f837520574d2cb6c5267b97554a8f6f92bc192,764e3630-ddac-4c21-af4b-9d32ffef082e,2020.0,8.0,Sanchezstad,529-540,IEEE International Conference on Data Engineering,12f22332-86f2-427f-ac83-030f79f320c0
72485bfd27f72cd7fcfdf548e8625470f6a9df8a,294911be-9099-4a8f-9b8e-832d1916ba08,2019.0,5.0,Mosleyshire,0916-0923,"Ubiquitous Computing, Electronics & Mobile Communication Conference",c63f07a9-ee53-41e7-8653-1a220f10aecf
8b5e0e681c248ef8991b388225a74cbe55d6f6b0,d7086d2b-86b6-4371-a442-97da4b3396e3,2021.0,3.0,East Susan,1-5,International Conference on Security of Information and Networks,a1a6bf6d-441a-4ebb-baa8-e086fe195cbf
b8382400ccaff401e82eb9af4d882ddb7ff44092,764e3630-ddac-4c21-af4b-9d32ffef082e,2018.0,6.0,Jordanland,458-469,IEEE International Conference on Data Engineering,efbeec43-0afe-4708-a67c-efeec6dcb816
f0a4bdbbebdd21b27b3572738d61c087da4780b0,1124d164-490d-4da9-b0c2-ce8a8dc98202,2023.0,3.0,North Brianburgh,6230-6232,BigData Congress [Services Society],06ac4eb2-9eac-489f-93d1-7d92d3ccc3a5
086ab4df92a4b439334aea1c9d143c83beb0275a,49bb481c-95dc-4e09-a921-95f6c7f78ab8,2022.0,7.0,Port Jessica,178-186,Conference of the Open Innovations Association,5bf14905-36fc-4e02-a382-74d6b39e815e
9a9a085445af4280b85acfd929209c5a3fbe9f1d,71826259-dbc2-44dc-9ffa-abf8abd1514e,2018.0,4.0,Murilloton,1-6,International Conference on Network and System Security,884d4403-1f79-47f5-a2f6-03173b6431f1
029b611e659c1cc2834a6ca9f010b1c18d98588d,0dc0e794-53db-401d-bd8f-8da9165b2865,2022.0,3.0,Austinport,393-398,International Conferences on Contemporary Computing and Informatics,473a6da9-8816-48a4-959d-6cc3e200cb77
414920f15379a60bb4625405c85456c98e836f52,e574da12-4e4c-4b78-a203-ae3719c0c4f7,2017.0,4.0,North Brent,298-304,Annual International Computer Software and Applications Conference,c2021086-1f99-4e5c-80b7-da6c1949d586
e2a3ddc90e93c054d6e7ea5c1d26557f5c758a31,47c47088-7640-441b-85ba-375fe8f5c3a4,2024.0,9.0,Lake Todd,1-5,International Conference on Computing Communication and Networking Technologies,21775910-8197-4d8b-ab5a-0fadac41c43f
ba8faaadc3428decc1b32ce55499a2345935ec9d,7431ff67-91dc-41fa-b322-1b1ca657025f,2022.0,8.0,Bauerside,,International Conference on Information and Knowledge Management,7e809d70-ae66-4e7e-b58b-bff1ac19f90b
a31d825f2449fda2912adaba4a2bf5036c6d76d8,d86fc550-8020-4944-9006-dd3f3642e0e2,2018.0,3.0,West James,1-6,International Conference on Communications and Information Technology,7ccae74d-4102-4b94-9a6d-3cdfa556e0b5
495d613854afc3e6ae0f88889bb12703fbeacc73,764e3630-ddac-4c21-af4b-9d32ffef082e,2024.0,12.0,Joestad,4262-4274,IEEE International Conference on Data Engineering,e2f793c6-eb39-415a-906d-5c4387aaab8a
c4f15726a193ba3425c859c0becd7dd55076f188,e1ce0fed-d655-40bd-b678-9adc73f2e582,2018.0,3.0,Lake Sandrahaven,300-307,International Symposium on High Performance Computing Systems and Applications,2be4a363-dbbe-4df6-a9fb-a28ef5d6b257
1026c955370fb44b7ebeea732211f29bde4d1e25,764e3630-ddac-4c21-af4b-9d32ffef082e,2016.0,4.0,Pruittberg,1440-1443,IEEE International Conference on Data Engineering,a2d03cdb-a34c-48fc-9041-265932108fd1
7b2eb7992b3462d0da6612648e039f626ed42e6a,1908b4f6-3f86-4f57-a6e1-169166fa8142,2023.0,3.0,Smithchester,408-412,International Conference on Virtual Reality,7fe537ee-d674-40ad-b144-8f7453ecfb14
1c67ab5d592005a6f360c1b3ebccdeb14cca670e,f63e4bb3-0e34-4ab9-8bf1-45fa94f94fe1,2022.0,3.0,East Kathryntown,138-143,International Conference on Recent Advances and Innovations in Engineering,5a51faec-b76b-4668-b195-400c5cb551de
2b061f7f108fdd4e90452aaaead574c7b4b5b780,d1b69d7d-e3ab-4c62-ba16-ab4974a0df98,2019.0,3.0,East Lisa,201-206,International Conference on Fog Computing,9f1faf29-fa63-42ef-845a-631f400cbc10
3310490e2a88b1ce2ad062ae4dfd597918c0dde4,1e33b3be-b2ab-46e9-96e8-d4eb4bad6e44,2023.0,5.0,East Peggytown,54-73,Annual Meeting of the Association for Computational Linguistics,b7788216-2269-449f-9186-fc621661d8bd
10a9b20ac0834dab013fdc7ad0b111dc34fd7901,651ffdd6-0649-433b-8890-3a3ef1a51f55,2023.0,4.0,Marshallhaven,566-571,"International Conference on Control, Automation and Information Sciences",cdc3b43a-d3fb-400e-9e9c-d0049c2b5027
771a3d29bf9535c165542801e9109305890340f0,acd15a6d-3248-41fb-8439-9a40aabe5608,2022.0,3.0,New Pamelaburgh,1063-1072,IEEE Workshop/Winter Conference on Applications of Computer Vision,93886f87-b16a-4a5c-af78-e4407937f107
1cde2e6c198c599f71a5bd7ab5fdeeba4a04a8b0,d0fd9a2e-7924-417b-8a2f-9f85acf31330,2018.0,3.0,New Nathanville,1-6,International Conference Innovation Engineering and Technology,33d74924-9a4c-4807-b924-631a197ba510
