paperId,venue_id,year,edition,location,pages,new_conference_name,editionId
49500b786a4c7d820b9250390321a18e8d5f89de,e37dd43d-80e9-4659-9799-3bee98bb4e81,2017.0,3.0,South Thomas,407-413,IEEE International Conference on Cognitive Informatics and Cognitive Computing,495e0b05-00c9-4ee0-a8fb-d4217c2146a6
6b8e073f9f83dffbac22697d248a95c69ffbc79f,68ae8b4a-daf7-4164-96f4-def7eb56b601,2019.0,3.0,Davishaven,1-5,International Conference on Sampling Theory and Applications,d5cd97f0-7b6f-4d69-93c2-d4e0f65d6047
4719fc4fb01f94102ef454cb1a6603b1aa4fa45a,ebcbaf26-62a6-4cb2-b637-b29091ca04d6,2019.0,3.0,Tuckerburgh,1-5,European Signal Processing Conference,9c4ed3b5-1e85-4a07-ad71-3d102ad9253c
cab5c101afcedf3fb02bda09380768c8c2cf45b4,e02accb9-dacc-43fd-995e-92fe9a825cc4,2019.0,5.0,Travisside,1591-1594,"Design, Automation and Test in Europe",78a5f46b-a662-43f4-a827-fe42f5a4af14
f2b13cedd1ba165c6736625cfdc5a6b4b8590f10,fe4d09f8-d278-4bfb-b73a-1a6a0e22f6a3,2021.0,4.0,Millermouth,3767-3772,American Control Conference,bff6dd52-2bc0-4d3f-a7cd-a78e0ffc25c6
1a957c8b6661b11279d9d505e81fb1a51de15740,cccf07c4-330a-4c98-9bf0-6155373ae7ca,2020.0,3.0,Patelport,172-177,Summa,8254da8e-f912-41e2-90c2-722106215a55
6c0d6ef7b2213af77f0852e471b5875326fb65e1,e574da12-4e4c-4b78-a203-ae3719c0c4f7,2024.0,11.0,Lake Ricardo,326-331,Annual International Computer Software and Applications Conference,19e76933-8d14-4606-9043-daef7c251c8f
f13be86c6ac24b163797693ac474e2ab91354e43,1c1a7c8a-c391-431c-934b-cf74458f9e6c,2017.0,3.0,New Marybury,1053-1057,"International Conference on Natural Computation, Fuzzy Systems and Knowledge Discovery",c008aead-ce23-460c-a634-3555c0d226d2
fa4b5075bc4bae0243f91c88d3c723956ff70bba,28a83bf1-b6e5-416f-8c5a-fdc53e54f3a1,2022.0,5.0,Johnsonview,1-6,International Conference on Automation and Computing,ff7fe34e-d7b8-4c79-8a08-033d4eeb087b
2fe8f92a5c98225ef945c0882efb8689d6b0b7a5,7175646f-9a56-40bb-8834-eefa48e5c83a,2021.0,3.0,Port Paulfurt,87-90,European Solid-State Circuits Conference,50a1b4f7-f5e3-4636-9ba2-67deff38d5ea
8c9273f2a488caec5a788a057fee6641e4ff5856,67f7f831-711a-43c8-8785-1e09005359b5,2023.0,6.0,Millsstad,6647-6655,International Joint Conference on Artificial Intelligence,99cc37e3-a820-4657-a0ab-56724e65dc4b
68fa68c9020c9f744f02274813fbe5d5a12c3359,764e3630-ddac-4c21-af4b-9d32ffef082e,2020.0,8.0,Sanchezstad,,IEEE International Conference on Data Engineering,12f22332-86f2-427f-ac83-030f79f320c0
9f3b7778fcb6fe2460c39a0eae4997f10ff81d16,6f5ccf6c-fd96-4a04-9b0e-f1eade928757,2022.0,3.0,Reginaton,1-6,International Conference on Applied Informatics and Communication,8dc472e0-1d55-4f39-aa55-278bf00dc55b
6e9a582ea7ef8fd164769799cfe4fed8e17dbdca,31c6e511-cc0b-42e2-901d-97b4b6f6605e,2018.0,3.0,South Scottberg,170-1707,International Conference on Field-Programmable Logic and Applications,c5369b45-bb96-46a1-9f81-f5a1c4f1e683
7396b87c86f9a6f1edf25f8753f787e9578d0afb,74f47cf8-2839-4a56-959a-524dd0ed9e3e,2021.0,5.0,Port Michael,623-634,International Conference on Extending Database Technology,8ebf0112-6170-48c3-91ec-0da94aa863fa
697427e043bf655245d290c4b88141c58abaf65c,6682f507-bba1-49f1-a361-cf7f43ab432b,2024.0,3.0,Ryanshire,738-744,International Conference on Robotics and Mechatronics,059b4e96-0c69-4945-8c3f-06438e8bb2d8
cc76b0a3d6a0bc9dbd2a0444d8aeedfb0ce391f4,b189dec0-41d0-4cea-a906-7c5186895904,2022.0,8.0,South David,3356-3361,Global Communications Conference,48f89bdd-f338-4683-8e02-e124935c1d8b
aa8a61d9976db75776ebdfb2d2360ebeeb4da54c,f80ba4a3-7aed-4021-b4d8-e4f50668847a,2021.0,4.0,Smithville,1-8,IEEE International Joint Conference on Neural Network,f426044c-6cce-4548-bfda-15ba1d2667aa
5ccfc444a34b44b30662734c9ce27ba83eecb751,764e3630-ddac-4c21-af4b-9d32ffef082e,2022.0,10.0,North Jamesview,164-177,IEEE International Conference on Data Engineering,760ed92f-a592-406e-8d91-161eff52032e
bc684a7c1565caa7a7780218b5a92016a5a684bc,3b0c38e5-6886-45d2-ad7b-6cb7dcb3c210,2019.0,3.0,Cameronborough,154-159,International Conferences on Data Science and Engineering,2b02d8ea-17a6-469e-b714-08d443cbea78
ad60724be1c36da5878b5f5e65a65d397bfdc73c,914d4734-285a-4cd8-bba1-eec0db26a512,2024.0,7.0,Port Jennifer,,International Conference on Supercomputing,db5dc779-faeb-4452-a62b-d8cbc896e5ef
1a4f6c9d048961748b44b4dbb222291b1d514864,bfdaa902-daba-44e2-9de0-df4e61fe2f80,2021.0,3.0,New Melissa,1-8,International Conference on Ubiquitous Information Management and Communication,56306594-20c5-411a-9dbb-341a3402fe55
924db726e462f768b16af1a081b153549bee5fca,7431ff67-91dc-41fa-b322-1b1ca657025f,2023.0,9.0,East Christopher,,International Conference on Information and Knowledge Management,7e7f585f-2b32-465d-b124-640de6e8ca50
0047110e62edb20e946f6d4e498e2506066c67ad,e574da12-4e4c-4b78-a203-ae3719c0c4f7,2020.0,7.0,Shortchester,1201-1205,Annual International Computer Software and Applications Conference,1a156987-6a30-43e9-b947-a4db6c6c082f
324617847cc591e3fb11f15cdcdfbc9374021b51,764e3630-ddac-4c21-af4b-9d32ffef082e,2022.0,10.0,North Jamesview,2073-2085,IEEE International Conference on Data Engineering,760ed92f-a592-406e-8d91-161eff52032e
a8a80de402cef8a41a85e1220e24818fc010e6f8,b96248c1-022a-4515-bae1-4ca0a18cc65d,2019.0,4.0,North Briannaberg,239-244,IEEE International Conference on Multimedia Big Data,f0bcc9d4-9467-4810-bd9a-e7a157e5082a
d487ab7853ec5577c1608d922753b7ca20d29f76,0d6f7fba-7092-46b3-8039-93458dba736b,2019.0,6.0,Darrellmouth,7928-7932,"IEEE International Conference on Acoustics, Speech, and Signal Processing",3b596c69-287a-4acd-867e-a0c7a72834df
394208ad800dce8e1d71825f59112c2ff702369d,7cd7bf33-3c9a-4b3f-8b1a-177673c6ca73,2022.0,4.0,North John,584-592,Consumer Communications and Networking Conference,1d703e12-2184-4361-813d-2db1e8a54f18
d1c91096304e8fcd534c4f4b9599ac6e6074f599,e15ba297-92fa-47c7-b7d3-edafbd9b8e5b,2019.0,3.0,East Jessica,388-392,IEEE Joint International Information Technology and Artificial Intelligence Conference,63003a3f-607c-464c-85a3-59d327e8d165
a031ca1b1bd16b39cd76ddca82fa44b7c6effc75,f8e385ef-b52f-4337-ab3b-e09080aec353,2023.0,4.0,Vanceville,372-380,International Conference on Edge Computing [Services Society],7293ce06-0a20-4ff6-ad71-67ca66434417
b77a786939bafa255acedfcd19867131ce1a8dea,9aa57e01-2dc2-4422-93b7-2b628326f78c,2022.0,5.0,West Melissaport,1650-1653,Information and Communication Technology Convergence,064b7c50-3c3f-4e29-8a16-5a3e4241c39b
07f187699a444dc8e2bebe212bf83f0181f823ef,e07422f9-c065-40c3-a37b-75e98dce79fe,2023.0,7.0,Wuberg,,The Web Conference,a99e0041-7196-446e-b1d0-8aa2cef4423d
f29c675e6d661d994b4ce075e2b0d1378e30944a,018dbcc4-52fa-4865-9b2f-6af96b2ca317,2018.0,3.0,North Tonyburgh,1-8,"International Conference on Engineering, Technology and Innovation",a23a25ed-ee47-4a96-8077-ee3550d3fc68
a7f98285e608190fb6d93cf594b9029df0f7ab68,c26d629a-34d5-4e9b-960a-9cc5eea60f18,2018.0,3.0,Lake Brianberg,626-630,International Conference on Smart City and Systems Engineering,9524b782-3f41-42db-a2c5-f7b28ca98863
88965ad7a493f8de6539e6a97542c901d3c69510,a4f30d5d-eda9-47ef-adc5-accd6c401486,2024.0,5.0,North Richardbury,1-6,"International Conference Electronic Systems, Signal Processing and Computing Technologies [ICESC-]",853763f2-149f-4a34-962c-41f360854211
d23dcca2fd6d30cc7284346684c79aae6daabb47,a0edb93b-1e95-4128-a295-6b1659149cef,2023.0,7.0,Georgebury,,Knowledge Discovery and Data Mining,906dd0aa-302d-476d-aba1-fe4c9ccb0a6f
ad5496f10ba104fa8f8f833019fe29524a5de756,764e3630-ddac-4c21-af4b-9d32ffef082e,2019.0,7.0,Peterstad,1964-1967,IEEE International Conference on Data Engineering,71dbf6ec-8eac-409a-8b5e-e5c6fbfb8744
94ee20fc8687b7526798dc1bf809a7e897580aca,9d83259d-8d79-4e98-a9e5-6237469bc057,2024.0,4.0,South Seanfurt,1-4,"IEEE International Conference on Networking, Architecture and Storages",653bed8f-f430-4676-b345-354a1e56285b
93c4fef12fa96e0984d12988b2eccbd8562e75a5,9ec28b59-afd2-4d10-9a97-44d984123c30,2020.0,6.0,Lake Kimberlyhaven,136-141,IEEE International Conference on Information Reuse and Integration,e0dca427-05b0-4dc0-8b74-5896a1c47281
f2efdd5822d89bfb9fcb2282d4acf9f19f01e4b0,764e3630-ddac-4c21-af4b-9d32ffef082e,2024.0,12.0,Joestad,4558-4572,IEEE International Conference on Data Engineering,e2f793c6-eb39-415a-906d-5c4387aaab8a
5c78c50cadac57ad266d78d9d36d962c402f1878,e5bfb038-10b2-4e43-b1e6-fea5aae180cf,2022.0,3.0,Jonathanport,,ITM Web of Conferences,bd9f23cc-ef11-415c-be9b-715782c7aa4f
f88f213c7c41aeef1bd9b47c65558202f4a9e5e7,6363ebc9-706a-4203-b804-148cbf8810ce,2015.0,3.0,East Deniseside,309-316,IEEE International Conference on Bioinformatics and Biomedicine,b01a84f9-7a3f-44cf-b22c-df4508b42ca7
b05306f0b142e5afb3974b1b79996e5b82653662,528ced1f-e949-4e1a-8fee-2ffbf0be551d,2020.0,5.0,Jonathanside,,Conference on Innovative Data Systems Research,eeffcbf6-dc76-4e5d-8c74-90096678e3a9
a56bc99651d52402d09f25da7c81e81a5fcffb60,7f92b1d2-f2b3-454d-adbe-ff02c83fe404,2023.0,5.0,East Nancy,1-10,IEEE Conference on Computer Communications,28dcc96a-98ec-4618-805f-fbdcda78bf22
c54472573614b6b923860f4db524dcd8773a7a7c,914d4734-285a-4cd8-bba1-eec0db26a512,2016.0,3.0,Nathanstad,,International Conference on Supercomputing,8fb42cc2-f857-4293-b9df-6f421b0b029e
1c88bfb18d4ddd636e25e621299a8d7c46f676df,764e3630-ddac-4c21-af4b-9d32ffef082e,2018.0,6.0,Jordanland,1465-1476,IEEE International Conference on Data Engineering,efbeec43-0afe-4708-a67c-efeec6dcb816
9d608aacc21dbf494ee81c2a5c3765e41ea8df64,914d4734-285a-4cd8-bba1-eec0db26a512,2022.0,6.0,Wallerside,,International Conference on Supercomputing,a81f7261-3c0b-4293-8e66-f26f25378a9e
8c60e7747306b3dfa6cf8798aee8affb11f006d4,e4f51561-5050-4b9c-87c2-c49957677fbf,2021.0,5.0,Walkertown,,European Conference on Computer Systems,150d50e4-de42-4359-a1aa-1b8a8a86f4ec
6ffe9d71d03941cf80d1bc9869e2834316b3db2a,e98ceee9-85f3-4656-a8af-803806c9d7b4,2024.0,3.0,Perkinsmouth,391-397,National Aerospace and Electronics Conference,421faa1b-608d-483a-a54a-9d89616f6154
c02a303fb19e51ffc36202529df4884b0570e2d2,975e1529-a14b-436f-ad7e-a09d8eabc50d,2024.0,4.0,Tiffanyborough,1-6,IEEE International Conference on Multimedia and Expo,4815e24f-f1cf-4797-860b-70a45c7107bc
786ff45f77d7960906b656e78c0ae7928c32fb83,2b17ce45-3b55-4be1-a978-fddecf5311de,2024.0,3.0,Lewisshire,1-17,"Automation, Control, and Information Technology",80963fb1-b5aa-4f63-ae6e-71736a3de345
94376bed5c276f8fe5c8a7a74abc35edc49b8dde,04c27a39-9b93-4b31-961a-c38ec6b40bbc,2022.0,6.0,Melissaton,0239-0245,"IEEE Annual Information Technology, Electronics and Mobile Communication Conference",675da10d-5b20-4aae-89ad-c4e9b0212e47
ebda5ad76f1bad366138c7a97dd52bd5f4e6bd56,47c47088-7640-441b-85ba-375fe8f5c3a4,2024.0,9.0,Lake Todd,1-5,International Conference on Computing Communication and Networking Technologies,21775910-8197-4d8b-ab5a-0fadac41c43f
20a2ea9865956497087a5a270a62435b35dfd31f,1dd57490-36c0-4706-a939-6ba41a501209,2012.0,4.0,Crystalborough,1589-1593,International Conference on Fuzzy Systems and Knowledge Discovery,d001b234-727a-444c-83d0-074c4d173295
7687d3574fa55e2332f263227b570f4508653679,804fd380-52e4-4dad-9650-b3106b8ed31b,2023.0,3.0,East Michael,1-7,International Conference on Electrical Engineering and Information Communication Technology,4e0def64-f604-4a7b-acb1-75ea1ad9b7d0
3966f65a26983069c423e5bd6ed48bfa39b5647d,9d8ef1a6-70f7-4a89-8fc7-913258eb0471,2024.0,4.0,Leslieview,1-5,International Conferences on Computing Advancements,47f38187-15a7-4d8f-a7a2-e9490e7e543a
29fa031268ffe0a80f7a4e3fb3a135db7fcd0b8d,41bf9ed3-85b3-4c90-b015-150e31690253,2023.0,6.0,North Adamchester,,Conference on Empirical Methods in Natural Language Processing,c8ba3bf3-0957-47a7-922b-d0749ed938d0
44b938a5bea9713adb0d1929325fc6072490eb6f,47c47088-7640-441b-85ba-375fe8f5c3a4,2022.0,7.0,Jacobview,1-6,International Conference on Computing Communication and Networking Technologies,7b1f0ed3-8d09-410c-94fd-90ca1cef15c8
2fab75cfd8394de70bca365572bc5bb04a1b1eb5,bdc2e585-4e48-4e36-8af1-6d859763d405,2021.0,5.0,Allenside,,AAAI Conference on Artificial Intelligence,b2b4c2cb-6e56-4a28-8a84-80ab566d7f8b
85903b66f05bc68520546ea71b92bdcaa900ac02,46990654-eb6c-4674-96bc-ba905dab2a86,2021.0,4.0,Micheleland,42-46,International Conference on Conceptual Structures,b8beb7ee-f99b-4e03-9a8c-eb11da61cd54
0e1ea0bde847b78af766dd81492bb4ee71ccc0d8,72b1619c-55d6-4f98-9218-23cd8aa74091,2023.0,3.0,North Grantside,11-16,"IEEE Uttar Pradesh Section International Conference on Electrical, Computer and Electronics Engineering",746a8251-2a9c-4caf-9f5f-d94b2f06575b
7df861dcb59d80cfba475c0ced10091ea7ed2f71,b1846822-6c7a-4679-979a-246fbd7388c3,2023.0,4.0,South Brianhaven,1-6,"International Conference on Information, Communications and Signal Processing",79c36802-5175-44db-af11-cfd3562a58b7
ed3eddf7934189158252b0946efd05d6ff953605,67f7f831-711a-43c8-8785-1e09005359b5,2023.0,6.0,Millsstad,4921-4929,International Joint Conference on Artificial Intelligence,99cc37e3-a820-4657-a0ab-56724e65dc4b
7a2d6c0a37ae07b882a7a26cecb5c553ac15564a,47c47088-7640-441b-85ba-375fe8f5c3a4,2024.0,9.0,Lake Todd,1-6,International Conference on Computing Communication and Networking Technologies,21775910-8197-4d8b-ab5a-0fadac41c43f
60064e4d873b92df47e27828b7df43d971ce24dd,6363ebc9-706a-4203-b804-148cbf8810ce,2024.0,10.0,Jodiberg,2276-2283,IEEE International Conference on Bioinformatics and Biomedicine,a66e9cd8-ab39-4778-a124-9ffe1a808de0
0ccac66251f2cc3e837750fcc118cfe413a0067a,e3b1672f-7753-4ca1-8a8b-586d2b4392ba,2022.0,3.0,New Kendrastad,1-4,IEEE International Conference on High Voltage Engineering and Application,6544b586-73b0-417d-b379-291ea6c313c5
3f52004f7cab47d97ee010c253211d5ed1a373a0,a4f30d5d-eda9-47ef-adc5-accd6c401486,2021.0,3.0,Wellsborough,1137-1142,"International Conference Electronic Systems, Signal Processing and Computing Technologies [ICESC-]",2b792e67-277b-4114-8291-2e4d9b388b7c
4646153f5a0019d5746209bac71e9b12b1e85a51,589ed020-784b-47ac-884d-9c6ae29fd509,2021.0,4.0,North Robert,1-6,International Conference Intelligent Computing and Control Systems,d587f4f8-4529-4072-9e77-870dfa0a3d8c
dcc15e7824f616c99276707ecb9d249aaeda9109,d7d7587f-a1e9-46a4-9db5-54c95787c6f1,2019.0,4.0,Dunlapshire,1367-1370,Annual International Conference of the IEEE Engineering in Medicine and Biology Society,aabdfbc2-dfc8-4a60-944a-7e2b9c8e6361
47fdce2b3b27819d61525247bc3de34f2d157983,bdc2e585-4e48-4e36-8af1-6d859763d405,2020.0,4.0,Carrieside,,AAAI Conference on Artificial Intelligence,41ff2b15-3046-49be-ae70-7953f4722f21
a135cbdfd09b48377e77141ce769896049753a83,46990654-eb6c-4674-96bc-ba905dab2a86,2019.0,3.0,South Miguel,1049-1055,International Conference on Conceptual Structures,4d369177-d251-4123-85a3-f08e6ae48640
b4288a08d4188c3ca2f0a7935cee34d067cd9342,6616207f-96f2-4427-927a-95d6e9b16252,2024.0,3.0,Jacksonberg,1-6,IEEE International Symposium on Compound Semiconductors,29059ba5-3a40-471f-8a9b-4d7933ddb748
22b5c8e08c397c9fb488c52c28ddfd6e5b7198f4,b6369c33-5d70-463c-8e82-95a54efa3cc8,2023.0,3.0,Guerrabury,1610-1614,International Conference on Information Photonics,8995a8b4-e3bf-44b8-bf96-bf4e71fa8ac5
d2add3b4cf3dd15b3d8bdcdd6914c834d4432762,47c47088-7640-441b-85ba-375fe8f5c3a4,2024.0,9.0,Lake Todd,1-7,International Conference on Computing Communication and Networking Technologies,21775910-8197-4d8b-ab5a-0fadac41c43f
3f2b059003b732013b9974412866791158577bec,809f6dd1-7dd8-4d79-a46d-4726c3a67128,2021.0,6.0,Josephburgh,,European Conference on Information Systems,6e0fd4fb-8c75-4f3d-aada-58671ccd6dbb
67b7b5f5108310ed10e521244c7703fd1695e474,79ad93e3-8152-45a5-a97c-d6c327592c09,2023.0,3.0,North Adrianamouth,1-5,"IEEE International Conference on Electrical, Computer and Communication Technologies",67b30bb7-3a09-4c2f-90a2-27fd4ec0fc27
d4faabadc8ea34e6c9027216fd3fe6182ae1f319,b56fce7a-4388-4ecb-b974-3c79c261b01b,2024.0,3.0,Autumnstad,1-6,Iranian Conference on Machine Vision and Image Processing,7d7fe875-4017-485b-873b-534d9005ca8f
22160bd1fbd3be6ddd8e7464bac2f930dafcaa6d,47c47088-7640-441b-85ba-375fe8f5c3a4,2024.0,9.0,Lake Todd,1-6,International Conference on Computing Communication and Networking Technologies,21775910-8197-4d8b-ab5a-0fadac41c43f
754c034ee7e070d5be153aca4ca803809ec9a639,a8f26d13-e373-4e48-b57b-ef89bf48f4db,2007.0,3.0,Hollyside,375-384,Asian Conference on Computer Vision,02287f2e-658e-44d0-a3e3-96fbefb63c8b
d3b59f3974d524f20fc766eb047ca344fb27c66a,47c47088-7640-441b-85ba-375fe8f5c3a4,2024.0,9.0,Lake Todd,1-5,International Conference on Computing Communication and Networking Technologies,21775910-8197-4d8b-ab5a-0fadac41c43f
0b821b5e2ecf129871f4b91a8363bf020be1458a,0cb0dcea-43f4-4a34-a1c3-ac211434f660,2018.0,3.0,Ramoston,394-400,International Conference Computing Methodologies and Communication,3ee0275c-7ef5-47cb-a6af-753627d971f5
7b1be133116185bba16077e265555909ee5413b6,809f6dd1-7dd8-4d79-a46d-4726c3a67128,2021.0,6.0,Josephburgh,,European Conference on Information Systems,6e0fd4fb-8c75-4f3d-aada-58671ccd6dbb
d0891adbdf76ccddaba54e4b58cc93288ba86315,bea6dbb8-4367-4c35-8e28-e749f3ad107c,2024.0,3.0,North Brandi,589-593,International Conference on Database Theory,3323c2e7-2cdf-4c06-8e31-727a39cf7d05
e479c427499ede1c8525dca3b89b465c26db840b,5b924e1a-30f3-4275-bdb8-5a15517c0fde,2023.0,3.0,East Charles,2203-2208,Asia-Pacific Signal and Information Processing Association Annual Summit and Conference,9eb05d05-0e38-4a85-895e-a4639b6d9048
a086f5c95a9f8d6a086fd983366928568b3bab21,60c45ccc-5528-42eb-85a9-7606a3d9b220,2021.0,5.0,North Danielchester,,International Conference on Interaction Sciences,fa9e5221-f5dd-403b-808a-8ea60e8fae73
e402a5c9feaa14863116734cda60b0ef29fecb14,a2f3e710-3f36-46fc-bf88-c40f1356cd43,2020.0,4.0,Christinaborough,1-4,Canadian Conference on Electrical and Computer Engineering,6aedcc29-b73c-4742-b64f-f5b3fc0e09ee
ebe10d3189518bb879f56bbac4968f37bdba5b40,2f5b84b3-aa20-451e-9579-e25d1e750644,2023.0,3.0,Loganport,1-7,International Conference on Robotics and Artificial Intelligence,9836aded-9755-4ed8-93a7-d54cfc7214c0
837b205f9804d13525b22f459cc11f8c734d0a85,0dc0e794-53db-401d-bd8f-8da9165b2865,2022.0,3.0,Austinport,1429-1435,International Conferences on Contemporary Computing and Informatics,473a6da9-8816-48a4-959d-6cc3e200cb77
d2850b4f8f66b08147c0558df74c83f30a2b0365,5498472a-b1bd-4a52-9687-734cdd3ed74c,2024.0,3.0,Karenborough,1-6,"Autonomous Infrastructure, Management and Security",b0eaac8f-e5f0-4c7b-b7c0-7b0722915d6e
b023bdba13a681981aed24902a203ffc6de3f5c7,e12d355b-ad1e-428d-ba3e-8373fd3a7bd8,2013.0,3.0,South Brian,328-334,Sai,69bab291-0764-4def-b3ed-cfd557a57204
be10cafe00480324b6d3217e5bdfd47bcfd21878,c5f8f5c8-58d0-46aa-bbb5-44ce60315635,2020.0,3.0,Holmesmouth,1-4,Signal Processing and Communications Applications Conference,0dc0d9ee-8719-404e-95fb-cb983551eab5
ea2fb89403ea1cd6af000e761e2f72eb7c150607,67f7f831-711a-43c8-8785-1e09005359b5,2022.0,5.0,New Billland,4432-4438,International Joint Conference on Artificial Intelligence,aee40e04-86a8-4c34-985f-22f646d2b136
37d6e32de122fe96e5e3542503215f53e7466d8a,66c268f7-ba60-443f-919d-e2c297910401,2017.0,3.0,New Jennifer,1-4,International Conference on Computational Collective Intelligence,14899776-8fee-4a88-afa5-10c9e8950a82
261975abf2ccfee959da581632072f3ee868d576,a0edb93b-1e95-4128-a295-6b1659149cef,2023.0,7.0,Georgebury,,Knowledge Discovery and Data Mining,906dd0aa-302d-476d-aba1-fe4c9ccb0a6f
bbb938b69ee2bcf3b4833bd2b3b8016a353bb30c,f51ff783-cdff-4e22-94fb-28e6336d17b3,2022.0,3.0,Lake William,,International Conference on Computational Linguistics,d21fc549-b210-44d7-b3fd-72a35dee9b3a
e3bd7bc291b2969f25fdd1a706d58b382a0e4b28,9012153e-aed6-447e-bccf-4aaf6f4bf52f,2022.0,5.0,Port Tyronefort,173-174,IEEE International Conference on Consumer Electronics,6cc8714c-39e2-4fc9-9718-ab76ca80d3cf
b54064c5d67d6c48d15bd7951f15a50cfbc472c1,79ad93e3-8152-45a5-a97c-d6c327592c09,2023.0,3.0,North Adrianamouth,1-6,"IEEE International Conference on Electrical, Computer and Communication Technologies",67b30bb7-3a09-4c2f-90a2-27fd4ec0fc27
23b6c1369e27185f3c9903b6c3c12252bfd75408,63410070-a9b9-46ac-bdec-92b016246795,2023.0,3.0,Rodriguezshire,1418-1423,International Conference on the Software Process,f0f698cf-087b-47b5-94a6-6fb05e87f8e3
aaf49da99d2785fc30949872ff83f5851393428a,d2423c06-c1fe-458d-bf8a-cc24aefe3f59,2015.0,3.0,Georgemouth,256-263,International Conference on Future Internet of Things and Cloud,21fd01fc-a7e6-4c2b-b5b5-dacd2161eddb
9ab569001b86eed9524068b278717599e10750b2,47c47088-7640-441b-85ba-375fe8f5c3a4,2024.0,9.0,Lake Todd,1-6,International Conference on Computing Communication and Networking Technologies,21775910-8197-4d8b-ab5a-0fadac41c43f
bf1afc6ea8483f13d183b4ddac387f15172a9fb2,1666219b-23e8-4300-acf2-d044d744a3f7,2024.0,4.0,Jenniferview,1-5,International Conference Control and Robots,0a8e8369-f14d-49b4-9685-3a473b6d635f
ae24c2dfb0e35d77dfc229bb2aeff68d63afddac,a0edb93b-1e95-4128-a295-6b1659149cef,2024.0,8.0,North Jon,3633-3644,Knowledge Discovery and Data Mining,d54b48eb-8ec1-4beb-b93b-7fd365c0271f
4fdaf912ad474e4d52b2b8915535ab5a9e8ea94d,1e33b3be-b2ab-46e9-96e8-d4eb4bad6e44,2021.0,3.0,West Michelle,5882-5893,Annual Meeting of the Association for Computational Linguistics,55d59f76-1e8a-42ab-af6d-472fa719a598
2c1fc85ff09d0ca604335e2c046f229ce523e670,d2e111a6-dd60-474c-ae8a-2b5773cca07d,2023.0,6.0,Port Rebecca,1620-1627,International Conference on Parallel and Distributed Systems,981d9168-99c5-49f1-9c62-59b31291c5a3
c01c2573efee36c9f6da25bf6d4e416d2c0a122a,b82ca0e9-eb48-4c67-b21c-a9f711521b1b,2020.0,3.0,Lauraside,1-5,Conference Information and Communication Technology,7466dcd7-7320-40ba-8adb-5d1c28720905
ac9b549caafbfbc70f790045a4b57a65abde9431,d0d8b615-5903-4da5-bfdf-4c06972ccf7a,2020.0,3.0,South Joseph,676-679,International Conference on Innovative Mechanisms for Industry Applications,fdaefe13-ebdb-4715-b6d2-73dcf4cbda3b
e4ed5c17cf0aa2d1ac579ab8a47881e33233d023,2a690a3e-4851-4fec-9602-44d1d477ffe8,2010.0,3.0,South Larry,306-308,"International Asia Conference on Informatics in Control, Automation and Robotics",5cdc5ce7-9ce2-478c-8f98-09b833df6844
cc5ef301c3ea9f73572f3936e1576df272f4e09b,809f6dd1-7dd8-4d79-a46d-4726c3a67128,2022.0,7.0,Burtonberg,,European Conference on Information Systems,d2023eef-6d82-4293-9126-f851b96f7199
8443df6a89b9fe90b265e1d3ec0fa32c6251bcb2,1666219b-23e8-4300-acf2-d044d744a3f7,2024.0,4.0,Jenniferview,1-5,International Conference Control and Robots,0a8e8369-f14d-49b4-9685-3a473b6d635f
887f99dcc0b19081f6ab44d655ad829950de103e,8ee71e17-421e-43db-ad2d-cc8af6217a0d,2024.0,3.0,Penaport,,European Conference on Information Retrieval,ef76dd94-5bc1-436a-b15c-0188ac34b7de
d762e7be95ce3e87c7bc2f532f04a7b4cdec93be,9ec28b59-afd2-4d10-9a97-44d984123c30,2021.0,7.0,North Katiefurt,326-333,IEEE International Conference on Information Reuse and Integration,5a36be0e-5351-4337-b5ae-8ace20e9edc1
6da71528cfd548eed62bb9d75169813f0a14cff5,0dc0e794-53db-401d-bd8f-8da9165b2865,2023.0,4.0,Andersonshire,1694-1698,International Conferences on Contemporary Computing and Informatics,4949654e-c83a-4ca1-a378-89569248e16c
e3b9c6dbcd314b596690ad4519c345486a0651e3,47c47088-7640-441b-85ba-375fe8f5c3a4,2024.0,9.0,Lake Todd,1-7,International Conference on Computing Communication and Networking Technologies,21775910-8197-4d8b-ab5a-0fadac41c43f
9ef7f2b8d60ccf4ced0b5da1eda6fa3b0bdb788e,7bf51cb8-4a54-4bc9-919c-8f67d9f7d0ae,2024.0,3.0,Danielberg,324-327,International Conference on Information Security and Cryptology,1a3290d4-b2ba-484b-9d65-ce2d75e16f2f
bd804d6788b6176b1c85bbd1c4934576ae0a832b,9aa57e01-2dc2-4422-93b7-2b628326f78c,2023.0,6.0,West David,154-159,Information and Communication Technology Convergence,47019c05-58fd-4948-85b6-8773895381e9
c2c96ac6873e8e56bc0dda332b49c79bbb212064,99db3270-3deb-4e55-91ee-b248735ea59b,2024.0,5.0,New Chadhaven,581-586,Confluence,6a4557ba-ad84-4a77-8717-a3e090ae9656
0b4519a5dbdc9872db312fab753d032335133e27,134cd1b3-6509-4002-bf0e-cd84d4bf358d,2024.0,4.0,Williamstown,151-160,International Conference on Digital Health,571578f4-2262-4b8d-930c-2cb518db2c80
71ca9748596f408bfcca6272579c9615a0c625b8,809f6dd1-7dd8-4d79-a46d-4726c3a67128,2020.0,5.0,Hudsonstad,,European Conference on Information Systems,7731ce23-cebd-4043-99f0-31bd6a216936
daae969477adfcd65827192592284a429a0dfaf6,bdc2e585-4e48-4e36-8af1-6d859763d405,2019.0,3.0,Keithfurt,6404-6412,AAAI Conference on Artificial Intelligence,4668ff64-11ca-4e7b-aed0-7720026959bc
66d45cd629200093fb57562aafa56e1014f5cf8d,0cb0dcea-43f4-4a34-a1c3-ac211434f660,2023.0,7.0,Port Marymouth,181-186,International Conference Computing Methodologies and Communication,8b7c81a9-95da-46d4-97c3-3ce56a672c06
61dfec3b99f70068027900c6732e47c858ed6870,28a83bf1-b6e5-416f-8c5a-fdc53e54f3a1,2024.0,6.0,Reedfort,1-6,International Conference on Automation and Computing,a480ca51-be60-4665-9f1d-458361099a1f
ec6dcf92d140bb4833b09e2a9660c0aa5d27b88d,8ba4a725-4a85-42ed-9476-46e9112d63f2,2020.0,3.0,Rodneystad,262-265,IEEE International Conference on Condition Monitoring and Diagnosis,146ec542-f860-498a-8260-68d130e2291b
a221c7f10a6668dcafe650a90420ee38bea21770,46990654-eb6c-4674-96bc-ba905dab2a86,2021.0,4.0,Micheleland,228-233,International Conference on Conceptual Structures,b8beb7ee-f99b-4e03-9a8c-eb11da61cd54
abe926051941186c567512768587ce7b3f93f787,47c47088-7640-441b-85ba-375fe8f5c3a4,2024.0,9.0,Lake Todd,1-5,International Conference on Computing Communication and Networking Technologies,21775910-8197-4d8b-ab5a-0fadac41c43f
c6fd7d326e073c587ec11e9b9dcfe542ff016627,72b1619c-55d6-4f98-9218-23cd8aa74091,2023.0,3.0,North Grantside,17-20,"IEEE Uttar Pradesh Section International Conference on Electrical, Computer and Electronics Engineering",746a8251-2a9c-4caf-9f5f-d94b2f06575b
4550cdbd19b28655f39546a3ec65d3fbae190f71,47c47088-7640-441b-85ba-375fe8f5c3a4,2023.0,8.0,Johnsonport,1-7,International Conference on Computing Communication and Networking Technologies,6a22c83b-720c-40ac-b127-cc752fb18085
ccc73eb3fcfc6db3e3070f6074edca1dbc6dcea0,0df6d80d-a5cc-4ae5-b93f-d608fcf78796,2023.0,3.0,Lake Thomasside,1-5,Biomedical Circuits and Systems Conference,85e11ba1-e46c-4eec-8ea2-f29416612898
